Name	Protein identifier	Contig id	Start	Stop	Strand	Gene symbol	Sequence name	Scope	Element type	Element subtype	Class	Subclass	Method	Target length	Reference sequence length	% Coverage of reference sequence	% Identity to reference sequence	Alignment length	Accession of closest sequence	Name of closest sequence	HMM id	HMM description
CIP61-11	OAGJNAIB_00261	CIP61-11_Contig_1	272241	273374	+	blaEC	BlaEC family class C beta-lactamase	plus	AMR	AMR	BETA-LACTAM	BETA-LACTAM	EXACTP	377	377	100.00	100.00	377	AAC77110.1	BlaEC family class C beta-lactamase	NF000185.2	BlaEC family class C beta-lactamase
CIP61-11	OAGJNAIB_00546	CIP61-11_Contig_1	534326	534592	+	ymgB	biofilm/acid-resistance regulator AriR	plus	STRESS	ACID	NA	NA	EXACTP	88	88	100.00	100.00	88	AAC74250.1	biofilm/acid-resistance regulator AriR	NA	NA
CIP61-11	OAGJNAIB_00555	CIP61-11_Contig_1	541450	541758	+	asr	acid resistance repetitive basic protein Asr	plus	STRESS	ACID	NA	NA	EXACTP	102	102	100.00	100.00	102	BAA15331.2	acid resistance repetitive basic protein Asr	NF033636.1	acid resistance repetitive basic protein Asr
CIP61-11	OAGJNAIB_00869	CIP61-11_Contig_1	856791	857975	-	emrD	multidrug efflux MFS transporter EmrD	plus	AMR	AMR	EFFLUX	EFFLUX	EXACTP	394	394	100.00	100.00	394	BAE77620.1	multidrug efflux MFS transporter EmrD	NA	NA
CIP61-11	OAGJNAIB_00931	CIP61-11_Contig_1	931326	932747	+	espX1	type III secretion system effector EspX1	plus	VIRULENCE	VIRULENCE	NA	NA	BLASTP	473	473	100.00	89.22	473	ADD54679.1	type III secretion system effector EspX1	NA	NA
CIP61-11	OAGJNAIB_01230	CIP61-11_Contig_1	1237330	1237623	+	iss	increased serum survival lipoprotein Iss	plus	VIRULENCE	VIRULENCE	NA	NA	EXACTP	97	97	100.00	100.00	97	BAG76115.1	increased serum survival lipoprotein Iss	NA	NA
CIP61-11	OAGJNAIB_01434	CIP61-11_Contig_1	1460540	1462342	+	ybtP	yersiniabactin ABC transporter ATP-binding/permease protein YbtP	plus	VIRULENCE	VIRULENCE	NA	NA	BLASTP	600	600	100.00	99.67	600	CAA21388.1	yersiniabactin ABC transporter ATP-binding/permease protein YbtP	NA	NA
CIP61-11	OAGJNAIB_01435	CIP61-11_Contig_1	1462329	1464131	+	ybtQ	yersiniabactin ABC transporter ATP-binding/permease protein YbtQ	plus	VIRULENCE	VIRULENCE	NA	NA	BLASTP	600	600	100.00	99.67	600	AAC69584.1	yersiniabactin ABC transporter ATP-binding/permease protein YbtQ	NA	NA
CIP61-11	OAGJNAIB_02035	CIP61-11_Contig_1	2089234	2090466	-	mdtM	multidrug efflux MFS transporter MdtM	plus	AMR	AMR	EFFLUX	EFFLUX	BLASTP	410	410	100.00	97.07	410	AAC77293.1	multidrug efflux MFS transporter MdtM	NA	NA
CIP61-11	OAGJNAIB_02324	CIP61-11_Contig_1	2395931	2396659	+	fieF	CDF family cation-efflux transporter FieF	plus	STRESS	METAL	NA	NA	PARTIALP	242	300	80.67	99.59	242	BAE77395.1	CDF family cation-efflux transporter FieF	NA	NA
CIP61-11	OAGJNAIB_02631	CIP61-11_Contig_1	2716187	2720443	+	fdeC	intimin-like adhesin FdeC	plus	VIRULENCE	VIRULENCE	NA	NA	BLASTP	1418	1416	100.00	94.14	1416	ABE05822.1	intimin-like adhesin FdeC	NA	NA
CIP61-11	OAGJNAIB_03184	CIP61-11_Contig_1	3334386	3334817	-	silE	silver-binding protein SilE	plus	STRESS	METAL	SILVER	SILVER	EXACTP	143	143	100.00	100.00	143	AAD11743.1	silver-binding protein SilE	NA	NA
CIP61-11	OAGJNAIB_03185	CIP61-11_Contig_1	3335062	3336543	-	silS	copper/silver sensor histidine kinase SilS	plus	STRESS	METAL	COPPER/SILVER	COPPER/SILVER	BLASTP	493	491	99.80	98.57	490	SPD96882.1	copper/silver sensor histidine kinase SilS	NA	NA
CIP61-11	OAGJNAIB_03186	CIP61-11_Contig_1	3336536	3337216	-	silR	copper/silver response regulator transcription factor SilR	plus	STRESS	METAL	COPPER/SILVER	COPPER/SILVER	BLASTP	226	226	100.00	97.79	226	SPD96883.1	copper/silver response regulator transcription factor SilR	NA	NA
CIP61-11	OAGJNAIB_03187	CIP61-11_Contig_1	3337406	3338791	+	silC	Cu(+)/Ag(+) efflux RND transporter outer membrane channel SilC	plus	STRESS	METAL	COPPER/SILVER	COPPER/SILVER	BLASTP	461	461	100.00	98.05	461	SPD96884.1	Cu(+)/Ag(+) efflux RND transporter outer membrane channel SilC	NA	NA
CIP61-11	OAGJNAIB_03188	CIP61-11_Contig_1	3338819	3339172	+	silF	Cu(+)/Ag(+) efflux RND transporter periplasmic metallochaperone SilF	plus	STRESS	METAL	COPPER/SILVER	COPPER/SILVER	BLASTP	117	117	100.00	97.44	117	KGL71342.1	Cu(+)/Ag(+) efflux RND transporter periplasmic metallochaperone SilF	NA	NA
CIP61-11	OAGJNAIB_03189	CIP61-11_Contig_1	3339286	3340578	+	silB	Cu(+)/Ag(+) efflux RND transporter periplasmic adaptor subunit SilB	plus	STRESS	METAL	COPPER/SILVER	COPPER/SILVER	BLASTP	430	430	100.00	96.28	430	AAD11748.1	Cu(+)/Ag(+) efflux RND transporter periplasmic adaptor subunit SilB	NA	NA
CIP61-11	OAGJNAIB_03190	CIP61-11_Contig_1	3340589	3343735	+	silA	Cu(+)/Ag(+) efflux RND transporter permease subunit SilA	plus	STRESS	METAL	COPPER/SILVER	COPPER/SILVER	BLASTP	1048	1048	100.00	98.66	1048	AAD11749.1	Cu(+)/Ag(+) efflux RND transporter permease subunit SilA	NA	NA
CIP61-11	OAGJNAIB_03192	CIP61-11_Contig_1	3344389	3346836	+	silP	Ag(+)-translocating P-type ATPase SilP	plus	STRESS	METAL	SILVER	SILVER	BLASTP	815	824	98.79	95.10	816	AAD11750.1	Ag(+)-translocating P-type ATPase SilP	NA	NA
CIP61-11	OAGJNAIB_03197	CIP61-11_Contig_1	3349453	3350634	+	pcoA	multicopper oxidase PcoA	plus	STRESS	METAL	COPPER	COPPER	INTERNAL_STOP	393	605	64.96	99.49	393	CAA58525.1	multicopper oxidase PcoA	NA	NA
CIP61-11	OAGJNAIB_03198	CIP61-11_Contig_1	3350634	3351530	+	pcoB	copper-binding protein PcoB	plus	STRESS	METAL	COPPER	COPPER	EXACTP	298	296	100.00	100.00	296	CAA58526.1	copper-binding protein PcoB	NA	NA
CIP61-11	OAGJNAIB_03199	CIP61-11_Contig_1	3351570	3351950	+	pcoC	copper resistance system metallochaperone PcoC	plus	STRESS	METAL	COPPER	COPPER	EXACTP	126	126	100.00	100.00	126	CAA58527.1	copper resistance system metallochaperone PcoC	NA	NA
CIP61-11	OAGJNAIB_03200	CIP61-11_Contig_1	3351955	3352884	+	pcoD	copper resistance inner membrane protein PcoD	plus	STRESS	METAL	COPPER	COPPER	EXACTP	309	309	100.00	100.00	309	CAA58528.1	copper resistance inner membrane protein PcoD	NA	NA
CIP61-11	OAGJNAIB_03201	CIP61-11_Contig_1	3352939	3353619	+	pcoR	copper response regulator transcription factor PcoR	plus	STRESS	METAL	COPPER	COPPER	EXACTP	226	226	100.00	100.00	226	CAA58529.1	copper response regulator transcription factor PcoR	NA	NA
CIP61-11	OAGJNAIB_03202	CIP61-11_Contig_1	3353616	3355016	+	pcoS	copper resistance membrane spanning protein PcoS	plus	STRESS	METAL	COPPER	COPPER	BLASTP	466	466	100.00	99.57	466	CAA58530.1	copper resistance membrane spanning protein PcoS	NA	NA
CIP61-11	OAGJNAIB_03203	CIP61-11_Contig_1	3355234	3355668	+	pcoE	copper resistance system metallochaperone PcoE	plus	STRESS	METAL	COPPER	COPPER	BLASTP	144	144	100.00	92.36	144	CAA58532.1	copper resistance system metallochaperone PcoE	NA	NA
CIP61-11	OAGJNAIB_03738	CIP61-11_Contig_1	3925477	3928581	-	acrF	multidrug efflux RND transporter permease subunit AcrF	plus	AMR	AMR	EFFLUX	EFFLUX	EXACTP	1034	1034	100.00	100.00	1034	AAC76298.1	multidrug efflux RND transporter permease subunit AcrF	NA	NA
CIP61-11	OAGJNAIB_03916	CIP61-11_Contig_1	4110711	4111799	-	capU	putative hexosyltransferase CapU	plus	VIRULENCE	VIRULENCE	NA	NA	EXACTP	362	362	100.00	100.00	362	AEQ15694.1	putative hexosyltransferase CapU	NA	NA
CIP61-11	OAGJNAIB_04042	CIP61-11_Contig_1	4232401	4232826	-	arsC	glutaredoxin-dependent arsenate reductase	plus	STRESS	METAL	ARSENIC	ARSENATE	BLASTP	141	141	100.00	94.33	141	AAA21096.1	glutaredoxin-dependent arsenate reductase	NF007456.1	glutaredoxin-dependent arsenate reductase
CIP61-11	OAGJNAIB_04044	CIP61-11_Contig_1	4234182	4234535	-	arsR	As(III)-sensing metalloregulatory transcriptional repressor ArsR	plus	STRESS	METAL	ARSENIC	ARSENIC	EXACTP	117	117	100.00	100.00	117	BAE77793.1	As(III)-sensing metalloregulatory transcriptional repressor ArsR	NA	NA
CIP61-11	OAGJNAIB_04469	CIP61-11_Contig_1	4678171	4679400	+	iroD	catecholate siderophore esterase IroD	plus	VIRULENCE	VIRULENCE	NA	NA	BLASTP	409	409	100.00	99.27	409	ACJ63529.1	catecholate siderophore esterase IroD	NA	NA
CIP61-11	OAGJNAIB_04470	CIP61-11_Contig_1	4679485	4680297	+	iroE	catecholate siderophore esterase IroE	plus	VIRULENCE	VIRULENCE	NA	NA	PARTIALP	270	318	83.02	97.73	264	ACJ63530.1	catecholate siderophore esterase IroE	NA	NA
CIP61-11	OAGJNAIB_04488	CIP61-11_Contig_1	4692275	4694362	+	iha	bifunctional siderophore receptor/adhesin Iha	plus	VIRULENCE	VIRULENCE	NA	NA	BLASTP	695	696	100.00	98.85	696	AAG55323.1	bifunctional siderophore receptor/adhesin Iha	NA	NA
CIP61-11	OAGJNAIB_04648	CIP61-11_Contig_1	4859620	4860417	+	nfaE	Dr family non-fimbrial adhesin I chaperone NfaE	plus	VIRULENCE	VIRULENCE	NA	NA	BLASTP	265	247	96.76	99.58	239	AAK17180.1	Dr family non-fimbrial adhesin I chaperone NfaE	NA	NA
CIP61-11	OAGJNAIB_04650	CIP61-11_Contig_1	4861289	4863040	+	afaC	AfaC-I/III family usher protein	plus	VIRULENCE	VIRULENCE	NA	NA	PARTIALP	583	860	67.79	99.31	583	CAW30799.1	AfaC-I/III family usher protein	NA	NA
