Name	Protein identifier	Contig id	Start	Stop	Strand	Gene symbol	Sequence name	Scope	Element type	Element subtype	Class	Subclass	Method	Target length	Reference sequence length	% Coverage of reference sequence	% Identity to reference sequence	Alignment length	Accession of closest sequence	Name of closest sequence	HMM id	HMM description
H299	IEIPIPKH_00001	H299_Contig_1	768	1628	-	blaTEM-1	broad-spectrum class A beta-lactamase TEM-1	core	AMR	AMR	BETA-LACTAM	BETA-LACTAM	ALLELEP	286	286	100.00	100.00	286	WP_000027057.1	broad-spectrum class A beta-lactamase TEM-1	NF000531.2	TEM family class A beta-lactamase
H299	IEIPIPKH_02161	H299_Contig_114	20617	20925	+	asr	acid resistance repetitive basic protein Asr	plus	STRESS	ACID	NA	NA	BLASTP	102	102	100.00	98.04	102	BAA15331.2	acid resistance repetitive basic protein Asr	NF033636.1	acid resistance repetitive basic protein Asr
H299	IEIPIPKH_02542	H299_Contig_117	25664	25996	-	emrE	multidrug efflux SMR transporter EmrE	plus	STRESS	BIOCIDE	EFFLUX	EFFLUX	BLASTP	110	110	100.00	98.18	110	CAA77936.1	multidrug efflux SMR transporter EmrE	NF000336.1	multidrug efflux SMR transporter EmrE
H299	IEIPIPKH_02675	H299_Contig_127	7060	8862	-	ybtQ	yersiniabactin ABC transporter ATP-binding/permease protein YbtQ	plus	VIRULENCE	VIRULENCE	NA	NA	BLASTP	600	600	100.00	99.67	600	AAC69584.1	yersiniabactin ABC transporter ATP-binding/permease protein YbtQ	NA	NA
H299	IEIPIPKH_02676	H299_Contig_127	8849	10651	-	ybtP	yersiniabactin ABC transporter ATP-binding/permease protein YbtP	plus	VIRULENCE	VIRULENCE	NA	NA	BLASTP	600	600	100.00	99.50	600	CAA21388.1	yersiniabactin ABC transporter ATP-binding/permease protein YbtP	NA	NA
H299	IEIPIPKH_03197	H299_Contig_131	102545	104722	-	sinH	intimin-like inverse autotransporter SinH	plus	VIRULENCE	VIRULENCE	NA	NA	HMM	725	730	100.00	72.91	731	AAL21411.1	intimin-like inverse autotransporter SinH	NF033423.1	intimin-like inverse autotransporter SinH
H299	IEIPIPKH_03649	H299_Contig_136	333012	337568	-	sslE	lipoprotein metalloprotease SslE	plus	VIRULENCE	VIRULENCE	NA	NA	BLASTP	1518	1520	100.00	96.32	1520	ADE89421.1	lipoprotein metalloprotease SslE	NF037973.1	lipoprotein metalloprotease SslE
H299	IEIPIPKH_03936	H299_Contig_136	638299	641403	+	acrF	multidrug efflux RND transporter permease subunit AcrF	plus	AMR	AMR	EFFLUX	EFFLUX	BLASTP	1034	1034	100.00	99.52	1034	AAC76298.1	multidrug efflux RND transporter permease subunit AcrF	NA	NA
H299	IEIPIPKH_04169	H299_Contig_145	48510	48863	+	arsR	As(III)-sensing metalloregulatory transcriptional repressor ArsR	plus	STRESS	METAL	ARSENIC	ARSENIC	BLASTP	117	117	100.00	96.58	117	BAE77793.1	As(III)-sensing metalloregulatory transcriptional repressor ArsR	NA	NA
H299	IEIPIPKH_04171	H299_Contig_145	50219	50644	+	arsC	glutaredoxin-dependent arsenate reductase	plus	STRESS	METAL	ARSENIC	ARSENATE	BLASTP	141	141	100.00	92.91	141	AAA21096.1	glutaredoxin-dependent arsenate reductase	NF007456.1	glutaredoxin-dependent arsenate reductase
H299	IEIPIPKH_00121	H299_Contig_15	2618	3817	-	tet(A)	tetracycline efflux MFS transporter Tet(A)	core	AMR	AMR	TETRACYCLINE	TETRACYCLINE	EXACTP	399	399	100.00	100.00	399	WP_000804064.1	tetracycline efflux MFS transporter Tet(A)	NF012193.0	tetracycline efflux MFS transporter Tet(A)
H299	IEIPIPKH_04378	H299_Contig_150	4834	7392	-	papC	P fimbrial usher protein PapC	plus	VIRULENCE	VIRULENCE	NA	NA	BLASTP	852	836	100.00	96.31	841	CAA43564.1	P fimbrial usher protein PapC	NA	NA
H299	IEIPIPKH_04379	H299_Contig_150	7402	7902	-	papH	P fimbrial minor subunit PapH	plus	VIRULENCE	VIRULENCE	NA	NA	PARTIALP	166	195	85.13	99.40	166	CAA43563.1	P fimbrial minor subunit PapH	NA	NA
H299	IEIPIPKH_04380	H299_Contig_150	8052	8603	-	papA	P fimbria major subunit PapA	plus	VIRULENCE	VIRULENCE	NA	NA	BLASTP	183	184	100.00	83.70	184	ENA25238.1	P fimbria major subunit PapA	NA	NA
H299	IEIPIPKH_04423	H299_Contig_152	22535	23719	+	emrD	multidrug efflux MFS transporter EmrD	plus	AMR	AMR	EFFLUX	EFFLUX	BLASTP	394	396	99.49	99.75	394	EFF04178.1	multidrug efflux MFS transporter EmrD	NA	NA
H299	IEIPIPKH_04475	H299_Contig_152	80298	80870	-	lpfA	long polar fimbria major subunit LpfA-O113	plus	VIRULENCE	VIRULENCE	NA	NA	BLASTP	190	190	100.00	98.95	190	ACB16424.1	long polar fimbria major subunit LpfA-O113	NA	NA
H299	IEIPIPKH_04667	H299_Contig_156	59334	60236	+	fieF	CDF family cation-efflux transporter FieF	plus	STRESS	METAL	NA	NA	EXACTP	300	300	100.00	100.00	300	BAE77395.1	CDF family cation-efflux transporter FieF	NA	NA
H299	IEIPIPKH_00123	H299_Contig_16	540	974	-	merR	mercury resistance transcriptional regulator MerR	plus	STRESS	METAL	MERCURY	MERCURY	BLASTP	144	144	100.00	93.75	144	CAA77320.1	mercury resistance transcriptional regulator MerR	NF010315.0	mercury resistance transcriptional regulator MerR
H299	IEIPIPKH_00124	H299_Contig_16	1046	1396	+	merT	mercuric transport protein MerT	plus	STRESS	METAL	MERCURY	MERCURY	EXACTP	116	116	100.00	100.00	116	AAB59075.1	mercuric transport protein MerT	NA	NA
H299	IEIPIPKH_00125	H299_Contig_16	1410	1685	+	merP	mercury resistance system periplasmic binding protein MerP	plus	STRESS	METAL	MERCURY	MERCURY	BLASTP	91	91	100.00	90.11	91	AAC38219.1	mercury resistance system periplasmic binding protein MerP	TIGR02052.1	mercury resistance system periplasmic binding protein MerP
H299	IEIPIPKH_00126	H299_Contig_16	1721	2143	+	merC	organomercurial transporter MerC	plus	STRESS	METAL	MERCURY	ORGANOMERCURY	EXACTP	140	140	100.00	100.00	140	AAC33908.1	organomercurial transporter MerC	NF033784.1	organomercurial transporter MerC
H299	IEIPIPKH_00127	H299_Contig_16	2195	3889	+	merA	mercury(II) reductase	plus	STRESS	METAL	MERCURY	MERCURY	HMM	564	561	100.00	85.31	565	AAC38220.1	mercury(II) reductase	TIGR02053.1	mercury(II) reductase
H299	IEIPIPKH_00129	H299_Contig_17	243	1079	-	aph(6)-Id	aminoglycoside O-phosphotransferase APH(6)-Id	core	AMR	AMR	AMINOGLYCOSIDE	STREPTOMYCIN	EXACTP	278	278	100.00	100.00	278	WP_000480968.1	aminoglycoside O-phosphotransferase APH(6)-Id	NF012171.0	APH(6)-I family aminoglycoside O-phosphotransferase
H299	IEIPIPKH_00130	H299_Contig_17	1079	1882	-	aph(3'')-Ib	aminoglycoside O-phosphotransferase APH(3'')-Ib	core	AMR	AMR	AMINOGLYCOSIDE	STREPTOMYCIN	EXACTP	267	267	100.00	100.00	267	WP_001082319.1	aminoglycoside O-phosphotransferase APH(3'')-Ib	NF032895.1	aminoglycoside O-phosphotransferase APH(3'')-Ib
H299	IEIPIPKH_00131	H299_Contig_17	1943	2758	-	sul2	sulfonamide-resistant dihydropteroate synthase Sul2	core	AMR	AMR	SULFONAMIDE	SULFONAMIDE	EXACTP	271	271	100.00	100.00	271	WP_001043265.1	sulfonamide-resistant dihydropteroate synthase Sul2	NF000295.1	sulfonamide-resistant dihydropteroate synthase Sul2
H299	IEIPIPKH_04903	H299_Contig_174	672	2873	-	iutA	ferric aerobactin receptor IutA	plus	VIRULENCE	VIRULENCE	NA	NA	BLASTP	733	731	99.73	89.71	729	AAN45165.2	ferric aerobactin receptor IutA	NA	NA
H299	IEIPIPKH_04904	H299_Contig_174	2955	4232	-	iucD	NADPH-dependent L-lysine N(6)-monooxygenase IucD	plus	VIRULENCE	VIRULENCE	NA	NA	BLASTP	425	445	95.51	97.65	425	AAD44749.1	NADPH-dependent L-lysine N(6)-monooxygenase IucD	NA	NA
H299	IEIPIPKH_04905	H299_Contig_174	4229	5971	-	iucC	NIS family aerobactin synthetase IucC	plus	VIRULENCE	VIRULENCE	NA	NA	BLASTP	580	580	100.00	97.59	580	AAN82073.1	NIS family aerobactin synthetase IucC	NA	NA
H299	IEIPIPKH_04906	H299_Contig_174	5971	6918	-	iucB	N(6)-hydroxylysine O-acetyltransferase IucB	plus	VIRULENCE	VIRULENCE	NA	NA	BLASTP	315	315	100.00	96.19	315	AAN82074.1	N(6)-hydroxylysine O-acetyltransferase IucB	NA	NA
H299	IEIPIPKH_04907	H299_Contig_174	6919	8643	-	iucA	aerobactin synthase IucA	plus	VIRULENCE	VIRULENCE	NA	NA	BLASTP	574	576	100.00	95.31	576	EGI25746.1	aerobactin synthase IucA	NA	NA
H299	IEIPIPKH_04934	H299_Contig_177	5853	6146	+	iss	increased serum survival lipoprotein Iss	plus	VIRULENCE	VIRULENCE	NA	NA	EXACTP	97	97	100.00	100.00	97	ADR26561.1	increased serum survival lipoprotein Iss	NA	NA
H299	IEIPIPKH_04937	H299_Contig_177	9291	10406	+	iroB	salmochelin biosynthesis C-glycosyltransferase IroB	plus	VIRULENCE	VIRULENCE	NA	NA	BLASTP	371	371	100.00	99.73	371	EOW04219.1	salmochelin biosynthesis C-glycosyltransferase IroB	NA	NA
H299	IEIPIPKH_04938	H299_Contig_177	10546	14205	+	iroC	salmochelin/enterobactin export ABC transporter IroC	plus	VIRULENCE	VIRULENCE	NA	NA	EXACTP	1219	1219	100.00	100.00	1219	AUH19662.1	salmochelin/enterobactin export ABC transporter IroC	NA	NA
H299	IEIPIPKH_04939	H299_Contig_177	14309	15538	+	iroD	catecholate siderophore esterase IroD	plus	VIRULENCE	VIRULENCE	NA	NA	BLASTP	409	409	100.00	99.76	409	ACJ63529.1	catecholate siderophore esterase IroD	NA	NA
H299	IEIPIPKH_04940	H299_Contig_177	15623	16579	+	iroE	catecholate siderophore esterase IroE	plus	VIRULENCE	VIRULENCE	NA	NA	BLASTP	318	318	100.00	99.69	318	ACJ63530.1	catecholate siderophore esterase IroE	NA	NA
H299	IEIPIPKH_04941	H299_Contig_177	16624	18801	-	iroN	siderophore salmochelin receptor IroN	plus	VIRULENCE	VIRULENCE	NA	NA	BLASTP	725	725	100.00	98.34	725	AAN76093.1	siderophore salmochelin receptor IroN	NA	NA
H299	IEIPIPKH_04961	H299_Contig_179	4439	6535	+	mchF	microcin H47 export transporter peptidase/ATP-binding subunit MchF	plus	VIRULENCE	VIRULENCE	NA	NA	BLASTP	698	698	100.00	99.57	698	AGC14252.1	microcin H47 export transporter peptidase/ATP-binding subunit MchF	NA	NA
H299	IEIPIPKH_04962	H299_Contig_179	6705	7016	-	cvaC	colicin V	plus	VIRULENCE	VIRULENCE	NA	NA	EXACTP	103	103	100.00	100.00	103	CAA40746.1	colicin V	NA	NA
H299	IEIPIPKH_00004	H299_Contig_2	336	809	-	dfrA5	trimethoprim-resistant dihydrofolate reductase DfrA5	core	AMR	AMR	TRIMETHOPRIM	TRIMETHOPRIM	EXACTP	157	157	100.00	100.00	157	WP_001317507.1	trimethoprim-resistant dihydrofolate reductase DfrA5	NF000330.1	trimethoprim-resistant dihydrofolate reductase DfrA
H299	IEIPIPKH_05009	H299_Contig_201	49	1077	+	tet(C)	tetracycline efflux MFS transporter Tet(C)	core	AMR	AMR	TETRACYCLINE	TETRACYCLINE	PARTIALP	342	396	86.36	100.00	342	WP_001297013.1	tetracycline efflux MFS transporter Tet(C)	NF012174.0	Tet(A)/Tet(B)/Tet(C) family tetracycline efflux MFS transporter
H299	IEIPIPKH_00248	H299_Contig_28	2327	4375	+	ireA	TonB-dependent siderophore receptor IreA	plus	VIRULENCE	VIRULENCE	NA	NA	BLASTP	682	682	100.00	99.85	682	AAN83596.1	TonB-dependent siderophore receptor IreA	NA	NA
H299	IEIPIPKH_00332	H299_Contig_32	22593	23726	-	blaEC	BlaEC family class C beta-lactamase	plus	AMR	AMR	BETA-LACTAM	BETA-LACTAM	BLASTP	377	377	100.00	97.88	377	AAZ85968.1	cephalosporin-hydrolyzing class C beta-lactamase EC-8	NF000185.2	BlaEC family class C beta-lactamase
H299	IEIPIPKH_00485	H299_Contig_32	181372	182604	-	mdtM	multidrug efflux MFS transporter MdtM	plus	AMR	AMR	EFFLUX	EFFLUX	BLASTP	410	410	100.00	97.56	410	AAC77293.1	multidrug efflux MFS transporter MdtM	NA	NA
H299	IEIPIPKH_00800	H299_Contig_41	786	4901	-	pic	serine protease autotransporter toxin Pic	plus	VIRULENCE	VIRULENCE	NA	NA	EXACTP	1371	1371	100.00	100.00	1371	AAN78833.1	serine protease autotransporter toxin Pic	NA	NA
H299	IEIPIPKH_00833	H299_Contig_42	28392	32522	-	vactox	vacuolating autotransporter toxin Vat	plus	VIRULENCE	VIRULENCE	NA	NA	EXACTP	1376	1376	100.00	100.00	1376	AAN78874.1	vacuolating autotransporter toxin Vat	NA	NA
H299	IEIPIPKH_00849	H299_Contig_42	49322	53569	+	fdeC	intimin-like adhesin FdeC	plus	VIRULENCE	VIRULENCE	NA	NA	BLASTP	1415	1416	100.00	98.16	1416	ABE05822.1	intimin-like adhesin FdeC	NA	NA
H299	IEIPIPKH_01101	H299_Contig_47	272	565	-	iss	increased serum survival lipoprotein Iss	plus	VIRULENCE	VIRULENCE	NA	NA	BLASTP	97	97	100.00	98.97	97	AGC85979.1	increased serum survival lipoprotein Iss	NA	NA
H299	IEIPIPKH_01104	H299_Contig_48	248	541	-	iss	increased serum survival lipoprotein Iss	plus	VIRULENCE	VIRULENCE	NA	NA	EXACTP	97	97	100.00	100.00	97	BAG76115.1	increased serum survival lipoprotein Iss	NA	NA
H299	IEIPIPKH_01742	H299_Contig_83	4131	4397	+	ymgB	biofilm/acid-resistance regulator AriR	plus	STRESS	ACID	NA	NA	BLASTP	88	88	100.00	98.86	88	AAC74250.1	biofilm/acid-resistance regulator AriR	NA	NA
