Name	Protein identifier	Contig id	Start	Stop	Strand	Gene symbol	Sequence name	Scope	Element type	Element subtype	Class	Subclass	Method	Target length	Reference sequence length	% Coverage of reference sequence	% Identity to reference sequence	Alignment length	Accession of closest sequence	Name of closest sequence	HMM id	HMM description
S1103_CU0263_IS04	PNGEIDCB_02025	NODE_11_length_160240_cov_25.327023	36769	37902	-	blaEC	BlaEC family class C beta-lactamase	plus	AMR	AMR	BETA-LACTAM	BETA-LACTAM	BLASTP	377	377	100.00	97.88	377	WP_063610930.1	extended-spectrum class C beta-lactamase EC-15	NF000185.2	BlaEC family class C beta-lactamase
S1103_CU0263_IS04	PNGEIDCB_02564	NODE_15_length_128709_cov_24.082343	20389	20697	+	asr	acid resistance repetitive basic protein Asr	plus	STRESS	ACID	NA	NA	BLASTP	102	102	100.00	99.02	102	BAA15331.2	acid resistance repetitive basic protein Asr	NF033636.1	acid resistance repetitive basic protein Asr
S1103_CU0263_IS04	PNGEIDCB_02866	NODE_17_length_127341_cov_24.800698	99057	100478	-	espX1	type III secretion system effector EspX1	plus	VIRULENCE	VIRULENCE	NA	NA	BLASTP	473	473	100.00	92.18	473	ADD54679.1	type III secretion system effector EspX1	NA	NA
S1103_CU0263_IS04	PNGEIDCB_02943	NODE_18_length_118063_cov_25.052371	56763	57665	+	fieF	CDF family cation-efflux transporter FieF	plus	STRESS	METAL	NA	NA	BLASTP	300	300	100.00	99.67	300	BAE77395.1	CDF family cation-efflux transporter FieF	NA	NA
S1103_CU0263_IS04	PNGEIDCB_03305	NODE_22_length_89893_cov_28.638928	27683	31939	-	fdeC	intimin-like adhesin FdeC	plus	VIRULENCE	VIRULENCE	NA	NA	BLASTP	1418	1416	100.00	94.21	1416	ABE05822.1	intimin-like adhesin FdeC	NA	NA
S1103_CU0263_IS04	PNGEIDCB_03750	NODE_28_length_62455_cov_22.585559	2533	2865	-	emrE	multidrug efflux SMR transporter EmrE	plus	STRESS	BIOCIDE	EFFLUX	EFFLUX	BLASTP	110	110	100.00	98.18	110	CAA77936.1	multidrug efflux SMR transporter EmrE	NF000336.1	multidrug efflux SMR transporter EmrE
S1103_CU0263_IS04	PNGEIDCB_03791	NODE_28_length_62455_cov_22.585559	35924	37726	-	ybtQ	yersiniabactin ABC transporter ATP-binding/permease protein YbtQ	plus	VIRULENCE	VIRULENCE	NA	NA	BLASTP	600	600	100.00	99.50	600	AAC69584.1	yersiniabactin ABC transporter ATP-binding/permease protein YbtQ	NA	NA
S1103_CU0263_IS04	PNGEIDCB_03792	NODE_28_length_62455_cov_22.585559	37713	39425	-	ybtP	yersiniabactin ABC transporter ATP-binding/permease protein YbtP	plus	VIRULENCE	VIRULENCE	NA	NA	BLASTP	570	600	95.00	99.47	570	CAA21388.1	yersiniabactin ABC transporter ATP-binding/permease protein YbtP	NA	NA
S1103_CU0263_IS04	PNGEIDCB_03851	NODE_29_length_59261_cov_29.648030	53440	54672	-	mdtM	multidrug efflux MFS transporter MdtM	plus	AMR	AMR	EFFLUX	EFFLUX	BLASTP	410	410	100.00	99.76	410	AAC77293.1	multidrug efflux MFS transporter MdtM	NA	NA
S1103_CU0263_IS04	PNGEIDCB_03961	NODE_31_length_52975_cov_26.700556	49175	50359	+	emrD	multidrug efflux MFS transporter EmrD	plus	AMR	AMR	EFFLUX	EFFLUX	EXACTP	394	394	100.00	100.00	394	BAE77620.1	multidrug efflux MFS transporter EmrD	NA	NA
S1103_CU0263_IS04	PNGEIDCB_04146	NODE_36_length_40252_cov_32.787579	15204	15629	-	arsC	glutaredoxin-dependent arsenate reductase	plus	STRESS	METAL	ARSENIC	ARSENATE	BLASTP	141	141	100.00	94.33	141	AAA21096.1	glutaredoxin-dependent arsenate reductase	NF007456.1	glutaredoxin-dependent arsenate reductase
S1103_CU0263_IS04	PNGEIDCB_04148	NODE_36_length_40252_cov_32.787579	16985	17338	-	arsR	As(III)-sensing metalloregulatory transcriptional repressor ArsR	plus	STRESS	METAL	ARSENIC	ARSENIC	BLASTP	117	117	100.00	99.15	117	BAE77793.1	As(III)-sensing metalloregulatory transcriptional repressor ArsR	NA	NA
S1103_CU0263_IS04	PNGEIDCB_04246	NODE_38_length_30826_cov_64.256919	16094	17293	+	tet(A)	tetracycline efflux MFS transporter Tet(A)	core	AMR	AMR	TETRACYCLINE	TETRACYCLINE	EXACTP	399	399	100.00	100.00	399	WP_000804064.1	tetracycline efflux MFS transporter Tet(A)	NF012193.0	tetracycline efflux MFS transporter Tet(A)
S1103_CU0263_IS04	PNGEIDCB_04462	NODE_45_length_21762_cov_36.741296	17931	18197	+	ymgB	biofilm/acid-resistance regulator AriR	plus	STRESS	ACID	NA	NA	EXACTP	88	88	100.00	100.00	88	AAC74250.1	biofilm/acid-resistance regulator AriR	NA	NA
S1103_CU0263_IS04	PNGEIDCB_04560	NODE_51_length_14880_cov_32.911707	612	4499	-	sat	serine protease autotransporter toxin Sat	plus	VIRULENCE	VIRULENCE	NA	NA	BLASTP	1295	1295	100.00	99.69	1295	CAE55775.1	serine protease autotransporter toxin Sat	NA	NA
S1103_CU0263_IS04	PNGEIDCB_04561	NODE_51_length_14880_cov_32.911707	5443	7641	-	iutA	ferric aerobactin receptor IutA	plus	VIRULENCE	VIRULENCE	NA	NA	BLASTP	732	731	100.00	99.59	731	AAN45165.2	ferric aerobactin receptor IutA	NA	NA
S1103_CU0263_IS04	PNGEIDCB_04562	NODE_51_length_14880_cov_32.911707	7644	8981	-	iucD	NADPH-dependent L-lysine N(6)-monooxygenase IucD	plus	VIRULENCE	VIRULENCE	NA	NA	BLASTP	445	445	100.00	99.78	445	AAD44749.1	NADPH-dependent L-lysine N(6)-monooxygenase IucD	NA	NA
S1103_CU0263_IS04	PNGEIDCB_04563	NODE_51_length_14880_cov_32.911707	8978	10720	-	iucC	NIS family aerobactin synthetase IucC	plus	VIRULENCE	VIRULENCE	NA	NA	BLASTP	580	580	100.00	99.48	580	AAN82073.1	NIS family aerobactin synthetase IucC	NA	NA
S1103_CU0263_IS04	PNGEIDCB_04564	NODE_51_length_14880_cov_32.911707	10720	11667	-	iucB	N(6)-hydroxylysine O-acetyltransferase IucB	plus	VIRULENCE	VIRULENCE	NA	NA	BLASTP	315	315	100.00	99.68	315	AAN82074.1	N(6)-hydroxylysine O-acetyltransferase IucB	NA	NA
S1103_CU0263_IS04	PNGEIDCB_04565	NODE_51_length_14880_cov_32.911707	11668	13392	-	iucA	aerobactin synthase IucA	plus	VIRULENCE	VIRULENCE	NA	NA	BLASTP	574	576	100.00	98.44	576	EGI25746.1	aerobactin synthase IucA	NA	NA
S1103_CU0263_IS04	PNGEIDCB_04665	NODE_59_length_10480_cov_74.715178	876	2051	-	senB	enterotoxin production-related protein TieB	plus	VIRULENCE	VIRULENCE	NA	NA	EXACTP	391	391	100.00	100.00	391	AAZ89288.1	enterotoxin production-related protein TieB	NA	NA
S1103_CU0263_IS04	PNGEIDCB_04700	NODE_62_length_9487_cov_27.706589	6832	8922	-	iha	bifunctional siderophore receptor/adhesin Iha	plus	VIRULENCE	VIRULENCE	NA	NA	EXACTP	696	696	100.00	100.00	696	ADN47767.1	bifunctional siderophore receptor/adhesin Iha	NA	NA
S1103_CU0263_IS04	NA	NODE_71_length_5486_cov_43.463302	74	562	+	papF	P fimbrial tip protein PapF	plus	VIRULENCE	VIRULENCE	NA	NA	BLASTX	163	167	97.60	97.55	163	CAA43569.1	P fimbrial tip protein PapF	NA	NA
S1103_CU0263_IS04	PNGEIDCB_04797	NODE_78_length_4209_cov_34.418683	643	1143	-	papH	P fimbrial minor subunit PapH	plus	VIRULENCE	VIRULENCE	NA	NA	PARTIALP	166	195	85.13	98.80	166	CAA43563.1	P fimbrial minor subunit PapH	NA	NA
S1103_CU0263_IS04	PNGEIDCB_04799	NODE_78_length_4209_cov_34.418683	1553	1855	-	papA	P fimbria major subunit PapA	plus	VIRULENCE	VIRULENCE	NA	NA	PARTIALP	100	185	51.89	88.54	96	CAA43562.1	P fimbria major subunit PapA	NA	NA
S1103_CU0263_IS04	PNGEIDCB_01376	NODE_7_length_175367_cov_25.167328	5368	8472	-	acrF	multidrug efflux RND transporter permease subunit AcrF	plus	AMR	AMR	EFFLUX	EFFLUX	BLASTP	1034	1034	100.00	99.61	1034	AAC76298.1	multidrug efflux RND transporter permease subunit AcrF	NA	NA
S1103_CU0263_IS04	PNGEIDCB_01568	NODE_8_length_169461_cov_28.559563	29788	34344	-	sslE	lipoprotein metalloprotease SslE	plus	VIRULENCE	VIRULENCE	NA	NA	HMM	1518	1520	100.00	86.65	1521	ADE89421.1	lipoprotein metalloprotease SslE	NF037973.1	lipoprotein metalloprotease SslE
