Name	Protein identifier	Contig id	Start	Stop	Strand	Gene symbol	Sequence name	Scope	Element type	Element subtype	Class	Subclass	Method	Target length	Reference sequence length	% Coverage of reference sequence	% Identity to reference sequence	Alignment length	Accession of closest sequence	Name of closest sequence	HMM id	HMM description
S1147_CU0586_IS03	GACFBNGK_02449	NODE_13_length_148271_cov_27.158670	33500	38065	-	sslE	lipoprotein metalloprotease SslE	plus	VIRULENCE	VIRULENCE	NA	NA	HMM	1521	1520	100.00	87.19	1522	ADE89421.1	lipoprotein metalloprotease SslE	NF037973.1	lipoprotein metalloprotease SslE
S1147_CU0586_IS03	GACFBNGK_02568	NODE_14_length_132447_cov_28.327854	12974	14671	+	eilA	HilA family transcriptional regulator EilA	plus	VIRULENCE	VIRULENCE	NA	NA	BLASTP	565	565	100.00	99.29	565	ACB16655.1	HilA family transcriptional regulator EilA	NA	NA
S1147_CU0586_IS03	GACFBNGK_02585	NODE_14_length_132447_cov_28.327854	43717	44901	+	emrD	multidrug efflux MFS transporter EmrD	plus	AMR	AMR	EFFLUX	EFFLUX	BLASTP	394	394	100.00	99.75	394	BAE77620.1	multidrug efflux MFS transporter EmrD	NA	NA
S1147_CU0586_IS03	GACFBNGK_00088	NODE_1_length_294792_cov_25.425401	91377	92798	-	espX1	type III secretion system effector EspX1	plus	VIRULENCE	VIRULENCE	NA	NA	BLASTP	473	473	100.00	93.45	473	ADD54679.1	type III secretion system effector EspX1	NA	NA
S1147_CU0586_IS03	GACFBNGK_03325	NODE_21_length_101945_cov_27.603310	6135	6932	+	nfaE	Dr family non-fimbrial adhesin I chaperone NfaE	plus	VIRULENCE	VIRULENCE	NA	NA	BLASTP	265	247	96.76	99.58	239	AAK17180.1	Dr family non-fimbrial adhesin I chaperone NfaE	NA	NA
S1147_CU0586_IS03	GACFBNGK_03326	NODE_21_length_101945_cov_27.603310	6972	9554	+	afaC	AfaC-I/III family usher protein	plus	VIRULENCE	VIRULENCE	NA	NA	BLASTP	860	860	100.00	99.88	860	CAW30799.1	AfaC-I/III family usher protein	NA	NA
S1147_CU0586_IS03	GACFBNGK_03439	NODE_22_length_92445_cov_26.054554	20077	20979	-	fieF	CDF family cation-efflux transporter FieF	plus	STRESS	METAL	NA	NA	EXACTP	300	300	100.00	100.00	300	BAE77395.1	CDF family cation-efflux transporter FieF	NA	NA
S1147_CU0586_IS03	GACFBNGK_03722	NODE_25_length_67765_cov_28.028986	63549	63815	-	ymgB	biofilm/acid-resistance regulator AriR	plus	STRESS	ACID	NA	NA	BLASTP	88	88	100.00	98.86	88	AAC74250.1	biofilm/acid-resistance regulator AriR	NA	NA
S1147_CU0586_IS03	GACFBNGK_03829	NODE_27_length_65005_cov_25.076053	20267	22069	-	ybtQ	yersiniabactin ABC transporter ATP-binding/permease protein YbtQ	plus	VIRULENCE	VIRULENCE	NA	NA	BLASTP	600	600	100.00	99.67	600	AAC69584.1	yersiniabactin ABC transporter ATP-binding/permease protein YbtQ	NA	NA
S1147_CU0586_IS03	GACFBNGK_03830	NODE_27_length_65005_cov_25.076053	22056	23858	-	ybtP	yersiniabactin ABC transporter ATP-binding/permease protein YbtP	plus	VIRULENCE	VIRULENCE	NA	NA	BLASTP	600	600	100.00	99.33	600	CAA21388.1	yersiniabactin ABC transporter ATP-binding/permease protein YbtP	NA	NA
S1147_CU0586_IS03	GACFBNGK_03880	NODE_28_length_56748_cov_33.032697	25035	25460	-	arsC	glutaredoxin-dependent arsenate reductase	plus	STRESS	METAL	ARSENIC	ARSENATE	BLASTP	141	141	100.00	93.62	141	AAA21096.1	glutaredoxin-dependent arsenate reductase	NF007456.1	glutaredoxin-dependent arsenate reductase
S1147_CU0586_IS03	GACFBNGK_03882	NODE_28_length_56748_cov_33.032697	26817	27170	-	arsR	As(III)-sensing metalloregulatory transcriptional repressor ArsR	plus	STRESS	METAL	ARSENIC	ARSENIC	BLASTP	117	117	100.00	98.29	117	BAE77793.1	As(III)-sensing metalloregulatory transcriptional repressor ArsR	NA	NA
S1147_CU0586_IS03	GACFBNGK_00650	NODE_3_length_240430_cov_27.046935	106528	106836	+	asr	acid resistance repetitive basic protein Asr	plus	STRESS	ACID	NA	NA	BLASTP	102	102	100.00	98.04	102	BAA15331.2	acid resistance repetitive basic protein Asr	NF033636.1	acid resistance repetitive basic protein Asr
S1147_CU0586_IS03	GACFBNGK_04844	NODE_56_length_12644_cov_33.701997	12171	12464	+	iss	increased serum survival lipoprotein Iss	plus	VIRULENCE	VIRULENCE	NA	NA	EXACTP	97	97	100.00	100.00	97	CAR12622.1	increased serum survival lipoprotein Iss	NA	NA
S1147_CU0586_IS03	GACFBNGK_04845	NODE_57_length_12154_cov_20.256189	147	1052	+	mph(A)	Mph(A) family macrolide 2'-phosphotransferase	core	AMR	AMR	MACROLIDE	MACROLIDE	EXACTP	301	301	100.00	100.00	301	WP_000219391.1	Mph(A) family macrolide 2'-phosphotransferase	NF000254.1	Mph(A) family macrolide 2'-phosphotransferase
S1147_CU0586_IS03	GACFBNGK_04853	NODE_57_length_12154_cov_20.256189	7690	8529	-	sul1	sulfonamide-resistant dihydropteroate synthase Sul1	core	AMR	AMR	SULFONAMIDE	SULFONAMIDE	EXACTP	279	279	100.00	100.00	279	WP_000259031.1	sulfonamide-resistant dihydropteroate synthase Sul1	NF000294.1	sulfonamide-resistant dihydropteroate synthase Sul1
S1147_CU0586_IS03	GACFBNGK_04854	NODE_57_length_12154_cov_20.256189	8523	8870	-	qacEdelta1	quaternary ammonium compound efflux SMR transporter QacE delta 1	core	STRESS	BIOCIDE	QUATERNARY AMMONIUM	QUATERNARY AMMONIUM	ALLELEP	115	115	100.00	100.00	115	WP_000679427.1	quaternary ammonium compound efflux SMR transporter QacE delta 1	NF000276.2	quaternary ammonium compound efflux SMR transporter QacE
S1147_CU0586_IS03	GACFBNGK_04855	NODE_57_length_12154_cov_20.256189	9076	9864	-	aadA5	ANT(3'')-Ia family aminoglycoside nucleotidyltransferase AadA5	core	AMR	AMR	AMINOGLYCOSIDE	STREPTOMYCIN	EXACTP	262	262	100.00	100.00	262	WP_000503573.1	ANT(3'')-Ia family aminoglycoside nucleotidyltransferase AadA5	NF012157.0	ANT(3'')-I family aminoglycoside nucleotidyltransferase
S1147_CU0586_IS03	GACFBNGK_04856	NODE_57_length_12154_cov_20.256189	9995	10468	-	dfrA17	trimethoprim-resistant dihydrofolate reductase DfrA17	core	AMR	AMR	TRIMETHOPRIM	TRIMETHOPRIM	EXACTP	157	157	100.00	100.00	157	WP_001389366.1	trimethoprim-resistant dihydrofolate reductase DfrA17	NF000330.1	trimethoprim-resistant dihydrofolate reductase DfrA
S1147_CU0586_IS03	GACFBNGK_04917	NODE_65_length_4821_cov_42.549747	469	801	+	emrE	multidrug efflux SMR transporter EmrE	plus	STRESS	BIOCIDE	EFFLUX	EFFLUX	BLASTP	110	110	100.00	97.27	110	CAA77936.1	multidrug efflux SMR transporter EmrE	NF000336.1	multidrug efflux SMR transporter EmrE
S1147_CU0586_IS03	GACFBNGK_04930	NODE_68_length_3679_cov_17.874792	113	973	+	aac(3)-IId	aminoglycoside N-acetyltransferase AAC(3)-IId	core	AMR	AMR	AMINOGLYCOSIDE	GENTAMICIN	EXACTP	286	286	100.00	100.00	286	WP_000557454.1	aminoglycoside N-acetyltransferase AAC(3)-IId	NF033080.0	AAC(3)-II family aminoglycoside N-acetyltransferase
S1147_CU0586_IS03	GACFBNGK_01349	NODE_6_length_204957_cov_27.073267	106365	110615	-	fdeC	intimin-like adhesin FdeC	plus	VIRULENCE	VIRULENCE	NA	NA	BLASTP	1416	1416	100.00	94.21	1416	ABE05822.1	intimin-like adhesin FdeC	NA	NA
S1147_CU0586_IS03	GACFBNGK_04939	NODE_70_length_3257_cov_41.621384	1912	2772	-	blaTEM-1	broad-spectrum class A beta-lactamase TEM-1	core	AMR	AMR	BETA-LACTAM	BETA-LACTAM	ALLELEP	286	286	100.00	100.00	286	WP_000027057.1	broad-spectrum class A beta-lactamase TEM-1	NF000531.2	TEM family class A beta-lactamase
S1147_CU0586_IS03	GACFBNGK_04942	NODE_71_length_3063_cov_193.750167	1702	2577	+	blaCTX-M-14	extended-spectrum class A beta-lactamase CTX-M-14	core	AMR	AMR	BETA-LACTAM	CEPHALOSPORIN	ALLELEP	291	291	100.00	100.00	291	WP_001617865.1	extended-spectrum class A beta-lactamase CTX-M-14	NF033089.1	CTX-M family extended-spectrum class A beta-lactamase
S1147_CU0586_IS03	GACFBNGK_01636	NODE_7_length_195217_cov_25.226950	186746	189850	+	acrF	multidrug efflux RND transporter permease subunit AcrF	plus	AMR	AMR	EFFLUX	EFFLUX	BLASTP	1034	1034	100.00	99.32	1034	AAC76298.1	multidrug efflux RND transporter permease subunit AcrF	NA	NA
S1147_CU0586_IS03	GACFBNGK_01781	NODE_8_length_193670_cov_27.961688	143279	144412	-	blaEC	BlaEC family class C beta-lactamase	plus	AMR	AMR	BETA-LACTAM	BETA-LACTAM	BLASTP	377	377	100.00	98.14	377	AAZ85968.1	cephalosporin-hydrolyzing class C beta-lactamase EC-8	NF000185.2	BlaEC family class C beta-lactamase
