Name	Protein identifier	Contig id	Start	Stop	Strand	Gene symbol	Sequence name	Scope	Element type	Element subtype	Class	Subclass	Method	Target length	Reference sequence length	% Coverage of reference sequence	% Identity to reference sequence	Alignment length	Accession of closest sequence	Name of closest sequence	HMM id	HMM description
S1169_CU0343_IS03	PLDGIONB_04846	NODE_102_length_1332_cov_42.215936	120	629	+	dfrA8	trimethoprim-resistant dihydrofolate reductase DfrA8	core	AMR	AMR	TRIMETHOPRIM	TRIMETHOPRIM	EXACTP	169	169	100.00	100.00	169	WP_000571065.1	trimethoprim-resistant dihydrofolate reductase DfrA8	NF000126.2	trimethoprim-resistant dihydrofolate reductase DfrA8
S1169_CU0343_IS03	PLDGIONB_02355	NODE_10_length_173672_cov_27.442006	86713	87897	-	emrD	multidrug efflux MFS transporter EmrD	plus	AMR	AMR	EFFLUX	EFFLUX	EXACTP	394	394	100.00	100.00	394	BAE77620.1	multidrug efflux MFS transporter EmrD	NA	NA
S1169_CU0343_IS03	PLDGIONB_02604	NODE_12_length_127305_cov_28.995756	28648	28914	+	ymgB	biofilm/acid-resistance regulator AriR	plus	STRESS	ACID	NA	NA	EXACTP	88	88	100.00	100.00	88	AAC74250.1	biofilm/acid-resistance regulator AriR	NA	NA
S1169_CU0343_IS03	PLDGIONB_02753	NODE_13_length_125971_cov_25.501501	59105	60007	-	fieF	CDF family cation-efflux transporter FieF	plus	STRESS	METAL	NA	NA	EXACTP	300	300	100.00	100.00	300	BAE77395.1	CDF family cation-efflux transporter FieF	NA	NA
S1169_CU0343_IS03	PLDGIONB_03383	NODE_19_length_88757_cov_25.016791	69711	70943	+	mdtM	multidrug efflux MFS transporter MdtM	plus	AMR	AMR	EFFLUX	EFFLUX	BLASTP	410	410	100.00	97.32	410	AAC77293.1	multidrug efflux MFS transporter MdtM	NA	NA
S1169_CU0343_IS03	PLDGIONB_00065	NODE_1_length_391671_cov_26.533366	56665	56973	+	asr	acid resistance repetitive basic protein Asr	plus	STRESS	ACID	NA	NA	EXACTP	102	102	100.00	100.00	102	BAA15331.2	acid resistance repetitive basic protein Asr	NF033636.1	acid resistance repetitive basic protein Asr
S1169_CU0343_IS03	PLDGIONB_04161	NODE_33_length_39907_cov_32.816244	14619	15044	-	arsC	glutaredoxin-dependent arsenate reductase	plus	STRESS	METAL	ARSENIC	ARSENATE	BLASTP	141	141	100.00	94.33	141	AAA21096.1	glutaredoxin-dependent arsenate reductase	NF007456.1	glutaredoxin-dependent arsenate reductase
S1169_CU0343_IS03	PLDGIONB_04163	NODE_33_length_39907_cov_32.816244	16400	16753	-	arsR	As(III)-sensing metalloregulatory transcriptional repressor ArsR	plus	STRESS	METAL	ARSENIC	ARSENIC	EXACTP	117	117	100.00	100.00	117	BAE77793.1	As(III)-sensing metalloregulatory transcriptional repressor ArsR	NA	NA
S1169_CU0343_IS03	PLDGIONB_04272	NODE_36_length_36410_cov_20.379462	24164	25966	+	ybtP	yersiniabactin ABC transporter ATP-binding/permease protein YbtP	plus	VIRULENCE	VIRULENCE	NA	NA	BLASTP	600	600	100.00	99.00	600	CAA21388.1	yersiniabactin ABC transporter ATP-binding/permease protein YbtP	NA	NA
S1169_CU0343_IS03	PLDGIONB_04273	NODE_36_length_36410_cov_20.379462	25953	27755	+	ybtQ	yersiniabactin ABC transporter ATP-binding/permease protein YbtQ	plus	VIRULENCE	VIRULENCE	NA	NA	BLASTP	600	600	100.00	99.17	600	AAC69584.1	yersiniabactin ABC transporter ATP-binding/permease protein YbtQ	NA	NA
S1169_CU0343_IS03	PLDGIONB_04285	NODE_37_length_34741_cov_30.511511	2552	2884	-	emrE	multidrug efflux SMR transporter EmrE	plus	STRESS	BIOCIDE	EFFLUX	EFFLUX	BLASTP	110	110	100.00	98.18	110	CAA77936.1	multidrug efflux SMR transporter EmrE	NF000336.1	multidrug efflux SMR transporter EmrE
S1169_CU0343_IS03	PLDGIONB_04361	NODE_39_length_30861_cov_37.626884	10608	12710	-	mchF	microcin H47 export transporter peptidase/ATP-binding subunit MchF	plus	VIRULENCE	VIRULENCE	NA	NA	EXACTP	700	700	100.00	100.00	700	AFS85685.1	microcin H47 export transporter peptidase/ATP-binding subunit MchF	NA	NA
S1169_CU0343_IS03	NA	NODE_39_length_30861_cov_37.626884	16433	16657	-	mchB	microcin H47	plus	VIRULENCE	VIRULENCE	NA	NA	EXACTX	75	75	100.00	100.00	75	CAB54534.2	microcin H47	NA	NA
S1169_CU0343_IS03	PLDGIONB_04378	NODE_39_length_30861_cov_37.626884	26933	29023	+	iha	bifunctional siderophore receptor/adhesin Iha	plus	VIRULENCE	VIRULENCE	NA	NA	EXACTP	696	696	100.00	100.00	696	AFS75030.1	bifunctional siderophore receptor/adhesin Iha	NA	NA
S1169_CU0343_IS03	PLDGIONB_00970	NODE_3_length_299894_cov_26.253044	291588	294692	+	acrF	multidrug efflux RND transporter permease subunit AcrF	plus	AMR	AMR	EFFLUX	EFFLUX	EXACTP	1034	1034	100.00	100.00	1034	AAC76298.1	multidrug efflux RND transporter permease subunit AcrF	NA	NA
S1169_CU0343_IS03	PLDGIONB_04421	NODE_41_length_26024_cov_68.126489	5483	6721	-	aatA	dispersin export ABC transporter outer membrane protein AatA	plus	VIRULENCE	VIRULENCE	NA	NA	BLASTP	412	412	100.00	89.81	412	CAU95796.1	dispersin export ABC transporter outer membrane protein AatA	NA	NA
S1169_CU0343_IS03	PLDGIONB_04458	NODE_42_length_25594_cov_26.069561	13924	14391	-	terW	tellurium resistance protein TerW	plus	STRESS	METAL	TELLURIUM	TELLURIUM	BLASTP	155	155	100.00	98.71	155	AAC44736.1	tellurium resistance protein TerW	NA	NA
S1169_CU0343_IS03	PLDGIONB_04465	NODE_42_length_25594_cov_26.069561	20964	21545	+	terZ	tellurium resistance-associated protein TerZ	plus	STRESS	METAL	TELLURIUM	TELLURIUM	BLASTP	193	193	100.00	98.96	193	AAA86846.1	tellurium resistance-associated protein TerZ	NA	NA
S1169_CU0343_IS03	PLDGIONB_04469	NODE_42_length_25594_cov_26.069561	24292	24870	+	terD	tellurium resistance membrane protein TerD	plus	STRESS	METAL	TELLURIUM	TELLURIUM	BLASTP	192	192	100.00	95.31	192	AAA98292.1	tellurium resistance membrane protein TerD	NA	NA
S1169_CU0343_IS03	PLDGIONB_04672	NODE_58_length_6578_cov_47.929977	1477	2313	-	aph(6)-Id	aminoglycoside O-phosphotransferase APH(6)-Id	core	AMR	AMR	AMINOGLYCOSIDE	STREPTOMYCIN	EXACTP	278	278	100.00	100.00	278	WP_000480972.1	aminoglycoside O-phosphotransferase APH(6)-Id	NF012171.0	APH(6)-I family aminoglycoside O-phosphotransferase
S1169_CU0343_IS03	PLDGIONB_04673	NODE_58_length_6578_cov_47.929977	2313	3116	-	aph(3'')-Ib	aminoglycoside O-phosphotransferase APH(3'')-Ib	core	AMR	AMR	AMINOGLYCOSIDE	STREPTOMYCIN	EXACTP	267	267	100.00	100.00	267	WP_001082319.1	aminoglycoside O-phosphotransferase APH(3'')-Ib	NF032895.1	aminoglycoside O-phosphotransferase APH(3'')-Ib
S1169_CU0343_IS03	PLDGIONB_04674	NODE_58_length_6578_cov_47.929977	3177	3992	-	sul2	sulfonamide-resistant dihydropteroate synthase Sul2	core	AMR	AMR	SULFONAMIDE	SULFONAMIDE	EXACTP	271	271	100.00	100.00	271	WP_001043260.1	sulfonamide-resistant dihydropteroate synthase Sul2	NF000295.1	sulfonamide-resistant dihydropteroate synthase Sul2
S1169_CU0343_IS03	PLDGIONB_04678	NODE_58_length_6578_cov_47.929977	5492	6352	-	blaTEM-1	broad-spectrum class A beta-lactamase TEM-1	core	AMR	AMR	BETA-LACTAM	BETA-LACTAM	ALLELEP	286	286	100.00	100.00	286	WP_000027057.1	broad-spectrum class A beta-lactamase TEM-1	NF000531.2	TEM family class A beta-lactamase
S1169_CU0343_IS03	PLDGIONB_01418	NODE_5_length_271278_cov_25.836051	207038	210526	-	fdeC	intimin-like adhesin FdeC	plus	VIRULENCE	VIRULENCE	NA	NA	PARTIALP	1162	1416	81.92	93.53	1160	ABE05822.1	intimin-like adhesin FdeC	NA	NA
S1169_CU0343_IS03	PLDGIONB_04687	NODE_60_length_6128_cov_63.779210	1430	1903	+	dfrA5	trimethoprim-resistant dihydrofolate reductase DfrA5	core	AMR	AMR	TRIMETHOPRIM	TRIMETHOPRIM	EXACTP	157	157	100.00	100.00	157	WP_001317507.1	trimethoprim-resistant dihydrofolate reductase DfrA5	NF000330.1	trimethoprim-resistant dihydrofolate reductase DfrA
S1169_CU0343_IS03	PLDGIONB_04688	NODE_60_length_6128_cov_63.779210	2087	2434	+	qacEdelta1	quaternary ammonium compound efflux SMR transporter QacE delta 1	core	STRESS	BIOCIDE	QUATERNARY AMMONIUM	QUATERNARY AMMONIUM	ALLELEP	115	115	100.00	100.00	115	WP_000679427.1	quaternary ammonium compound efflux SMR transporter QacE delta 1	NF000276.2	quaternary ammonium compound efflux SMR transporter QacE
S1169_CU0343_IS03	PLDGIONB_04689	NODE_60_length_6128_cov_63.779210	2428	3267	+	sul1	sulfonamide-resistant dihydropteroate synthase Sul1	core	AMR	AMR	SULFONAMIDE	SULFONAMIDE	EXACTP	279	279	100.00	100.00	279	WP_000259031.1	sulfonamide-resistant dihydropteroate synthase Sul1	NF000294.1	sulfonamide-resistant dihydropteroate synthase Sul1
S1169_CU0343_IS03	PLDGIONB_04771	NODE_74_length_4267_cov_75.867542	849	2054	+	tet(B)	tetracycline efflux MFS transporter Tet(B)	core	AMR	AMR	TETRACYCLINE	TETRACYCLINE	EXACTP	401	401	100.00	100.00	401	WP_001089068.1	tetracycline efflux MFS transporter Tet(B)	NF012190.1	tetracycline efflux MFS transporter Tet(B)
S1169_CU0343_IS03	PLDGIONB_01856	NODE_7_length_219763_cov_26.205407	164383	165516	-	blaEC	BlaEC family class C beta-lactamase	plus	AMR	AMR	BETA-LACTAM	BETA-LACTAM	EXACTP	377	377	100.00	100.00	377	AAC77110.1	BlaEC family class C beta-lactamase	NF000185.2	BlaEC family class C beta-lactamase
S1169_CU0343_IS03	NA	NODE_8_length_210312_cov_25.161082	203604	204755	+	espX1	type III secretion system effector EspX1	plus	VIRULENCE	VIRULENCE	NA	NA	PARTIALX	384	473	81.18	90.36	384	ADD54679.1	type III secretion system effector EspX1	NA	NA
