Name	Protein identifier	Contig id	Start	Stop	Strand	Gene symbol	Sequence name	Scope	Element type	Element subtype	Class	Subclass	Method	Target length	Reference sequence length	% Coverage of reference sequence	% Identity to reference sequence	Alignment length	Accession of closest sequence	Name of closest sequence	HMM id	HMM description
S1172_CU0358_IS03	EOKFEKHF_02864	NODE_15_length_125739_cov_54.742277	59105	60007	-	fieF	CDF family cation-efflux transporter FieF	plus	STRESS	METAL	NA	NA	EXACTP	300	300	100.00	100.00	300	BAE77395.1	CDF family cation-efflux transporter FieF	NA	NA
S1172_CU0358_IS03	EOKFEKHF_03121	NODE_17_length_109120_cov_56.053979	86474	87658	-	emrD	multidrug efflux MFS transporter EmrD	plus	AMR	AMR	EFFLUX	EFFLUX	EXACTP	394	394	100.00	100.00	394	BAE77620.1	multidrug efflux MFS transporter EmrD	NA	NA
S1172_CU0358_IS03	EOKFEKHF_03213	NODE_18_length_97748_cov_55.765550	69688	70947	+	mdtM	multidrug efflux MFS transporter MdtM	plus	AMR	AMR	EFFLUX	EFFLUX	BLASTP	419	410	98.29	97.27	403	AAC77293.1	multidrug efflux MFS transporter MdtM	NA	NA
S1172_CU0358_IS03	EOKFEKHF_03427	NODE_21_length_80531_cov_54.620367	41615	43327	+	ybtP	yersiniabactin ABC transporter ATP-binding/permease protein YbtP	plus	VIRULENCE	VIRULENCE	NA	NA	BLASTP	570	600	95.00	99.65	570	CAA21388.1	yersiniabactin ABC transporter ATP-binding/permease protein YbtP	NA	NA
S1172_CU0358_IS03	EOKFEKHF_03428	NODE_21_length_80531_cov_54.620367	43314	45116	+	ybtQ	yersiniabactin ABC transporter ATP-binding/permease protein YbtQ	plus	VIRULENCE	VIRULENCE	NA	NA	BLASTP	600	600	100.00	99.67	600	AAC69584.1	yersiniabactin ABC transporter ATP-binding/permease protein YbtQ	NA	NA
S1172_CU0358_IS03	EOKFEKHF_03611	NODE_23_length_76786_cov_67.802579	72008	75895	+	sat	serine protease autotransporter toxin Sat	plus	VIRULENCE	VIRULENCE	NA	NA	BLASTP	1295	1295	100.00	99.69	1295	AFK88558.1	serine protease autotransporter toxin Sat	NA	NA
S1172_CU0358_IS03	EOKFEKHF_03728	NODE_25_length_60328_cov_56.586745	51866	54970	+	acrF	multidrug efflux RND transporter permease subunit AcrF	plus	AMR	AMR	EFFLUX	EFFLUX	EXACTP	1034	1034	100.00	100.00	1034	AAC76298.1	multidrug efflux RND transporter permease subunit AcrF	NA	NA
S1172_CU0358_IS03	EOKFEKHF_03867	NODE_28_length_56622_cov_165.585251	18640	19878	-	aatA	dispersin export ABC transporter outer membrane protein AatA	plus	VIRULENCE	VIRULENCE	NA	NA	BLASTP	412	412	100.00	99.76	412	CAU95796.1	dispersin export ABC transporter outer membrane protein AatA	NA	NA
S1172_CU0358_IS03	EOKFEKHF_03872	NODE_28_length_56622_cov_165.585251	25309	25509	-	aar	AggR-activated transcriptional regulator Aar	plus	VIRULENCE	VIRULENCE	NA	NA	EXACTP	66	66	100.00	100.00	66	ASK37426.1	AggR-activated transcriptional regulator Aar	NA	NA
S1172_CU0358_IS03	EOKFEKHF_03873	NODE_28_length_56622_cov_165.585251	26240	26590	+	aap	dispersin Aap	plus	VIRULENCE	VIRULENCE	NA	NA	BLASTP	116	116	100.00	96.55	116	CBG27807.1	dispersin Aap	NA	NA
S1172_CU0358_IS03	EOKFEKHF_03874	NODE_28_length_56622_cov_165.585251	27431	28228	+	aggR	aggregative adherence transcriptional regulator AggR	plus	VIRULENCE	VIRULENCE	NA	NA	EXACTP	265	265	100.00	100.00	265	CAA83535.1	aggregative adherence transcriptional regulator AggR	NA	NA
S1172_CU0358_IS03	NA	NODE_28_length_56622_cov_165.585251	36940	37053	+	astA	heat-stable enterotoxin EAST1	plus	VIRULENCE	VIRULENCE	NA	NA	BLASTX	38	38	100.00	97.37	38	AAA20885.1	heat-stable enterotoxin EAST1	NA	NA
S1172_CU0358_IS03	EOKFEKHF_03888	NODE_28_length_56622_cov_165.585251	37744	38262	-	aggA	aggregative adherence fimbria I major subunit AggA	plus	VIRULENCE	VIRULENCE	NA	NA	BLASTP	172	172	100.00	99.42	172	EMS03085.1	aggregative adherence fimbria I major subunit AggA	NA	NA
S1172_CU0358_IS03	EOKFEKHF_03889	NODE_28_length_56622_cov_165.585251	38363	38800	-	aggB	aggregative adherence fimbria I minor subunit AggB	plus	VIRULENCE	VIRULENCE	NA	NA	BLASTP	145	145	100.00	97.93	145	EHF16297.1	aggregative adherence fimbria I minor subunit AggB	NA	NA
S1172_CU0358_IS03	EOKFEKHF_03890	NODE_28_length_56622_cov_165.585251	38814	41198	-	aggC	aggregative adherence fimbria I usher protein AggC	plus	VIRULENCE	VIRULENCE	NA	NA	BLASTP	794	842	94.30	99.75	794	AAA57452.1	aggregative adherence fimbria I usher protein AggC	NA	NA
S1172_CU0358_IS03	NA	NODE_28_length_56622_cov_165.585251	41359	42114	-	aggD	aggregative adherence fimbria I chaperone AggD	plus	VIRULENCE	VIRULENCE	NA	NA	EXACTX	252	252	100.00	100.00	252	AAA57451.1	aggregative adherence fimbria I chaperone AggD	NA	NA
S1172_CU0358_IS03	EOKFEKHF_00454	NODE_2_length_299473_cov_57.723503	133694	134827	+	blaEC	BlaEC family class C beta-lactamase	plus	AMR	AMR	BETA-LACTAM	BETA-LACTAM	EXACTP	377	377	100.00	100.00	377	AAC77110.1	BlaEC family class C beta-lactamase	NF000185.2	BlaEC family class C beta-lactamase
S1172_CU0358_IS03	EOKFEKHF_04126	NODE_33_length_42520_cov_74.493415	14619	15044	-	arsC	glutaredoxin-dependent arsenate reductase	plus	STRESS	METAL	ARSENIC	ARSENATE	BLASTP	141	141	100.00	94.33	141	AAA21096.1	glutaredoxin-dependent arsenate reductase	NF007456.1	glutaredoxin-dependent arsenate reductase
S1172_CU0358_IS03	EOKFEKHF_04128	NODE_33_length_42520_cov_74.493415	16400	16753	-	arsR	As(III)-sensing metalloregulatory transcriptional repressor ArsR	plus	STRESS	METAL	ARSENIC	ARSENIC	EXACTP	117	117	100.00	100.00	117	BAE77793.1	As(III)-sensing metalloregulatory transcriptional repressor ArsR	NA	NA
S1172_CU0358_IS03	EOKFEKHF_04288	NODE_37_length_32365_cov_63.350502	9101	12139	-	fdeC	intimin-like adhesin FdeC	plus	VIRULENCE	VIRULENCE	NA	NA	PARTIALP	1012	1416	71.47	95.75	1012	ABE05822.1	intimin-like adhesin FdeC	NA	NA
S1172_CU0358_IS03	EOKFEKHF_04339	NODE_39_length_30005_cov_86.036688	973	3063	-	iha	bifunctional siderophore receptor/adhesin Iha	plus	VIRULENCE	VIRULENCE	NA	NA	EXACTP	696	696	100.00	100.00	696	AAG55323.1	bifunctional siderophore receptor/adhesin Iha	NA	NA
S1172_CU0358_IS03	NA	NODE_39_length_30005_cov_86.036688	13348	13572	+	mchB	microcin H47	plus	VIRULENCE	VIRULENCE	NA	NA	EXACTX	75	75	100.00	100.00	75	CAB54534.2	microcin H47	NA	NA
S1172_CU0358_IS03	EOKFEKHF_04356	NODE_39_length_30005_cov_86.036688	17295	19397	+	mchF	microcin H47 export transporter peptidase/ATP-binding subunit MchF	plus	VIRULENCE	VIRULENCE	NA	NA	BLASTP	700	700	100.00	99.86	700	AFS85685.1	microcin H47 export transporter peptidase/ATP-binding subunit MchF	NA	NA
S1172_CU0358_IS03	EOKFEKHF_04376	NODE_40_length_29021_cov_68.340865	9853	10431	-	terD	tellurium resistance membrane protein TerD	plus	STRESS	METAL	TELLURIUM	TELLURIUM	BLASTP	192	192	100.00	95.31	192	AAA98292.1	tellurium resistance membrane protein TerD	NA	NA
S1172_CU0358_IS03	EOKFEKHF_04380	NODE_40_length_29021_cov_68.340865	13178	13759	-	terZ	tellurium resistance-associated protein TerZ	plus	STRESS	METAL	TELLURIUM	TELLURIUM	BLASTP	193	193	100.00	98.96	193	AAA86846.1	tellurium resistance-associated protein TerZ	NA	NA
S1172_CU0358_IS03	EOKFEKHF_04387	NODE_40_length_29021_cov_68.340865	20332	20799	+	terW	tellurium resistance protein TerW	plus	STRESS	METAL	TELLURIUM	TELLURIUM	BLASTP	155	155	100.00	98.71	155	AAC44736.1	tellurium resistance protein TerW	NA	NA
S1172_CU0358_IS03	EOKFEKHF_04399	NODE_41_length_25884_cov_100.122796	3004	3510	+	aaiC	type VI secretion system protein AaiC/Hcp2	plus	VIRULENCE	VIRULENCE	NA	NA	EXACTP	168	168	100.00	100.00	168	CBG37385.1	type VI secretion system protein AaiC/Hcp2	NA	NA
S1172_CU0358_IS03	EOKFEKHF_04422	NODE_42_length_22047_cov_89.320482	1920	3119	+	tet(A)	tetracycline efflux MFS transporter Tet(A)	core	AMR	AMR	TETRACYCLINE	TETRACYCLINE	EXACTP	399	399	100.00	100.00	399	WP_000804064.1	tetracycline efflux MFS transporter Tet(A)	NF012193.0	tetracycline efflux MFS transporter Tet(A)
S1172_CU0358_IS03	EOKFEKHF_04425	NODE_42_length_22047_cov_89.320482	4220	5080	-	blaTEM-1	broad-spectrum class A beta-lactamase TEM-1	core	AMR	AMR	BETA-LACTAM	BETA-LACTAM	ALLELEP	286	286	100.00	100.00	286	WP_000027057.1	broad-spectrum class A beta-lactamase TEM-1	NF000531.2	TEM family class A beta-lactamase
S1172_CU0358_IS03	EOKFEKHF_04440	NODE_43_length_18864_cov_86.214350	981	5072	-	espI	serine protease autotransporter EspI	plus	VIRULENCE	VIRULENCE	NA	NA	BLASTP	1363	1363	100.00	98.97	1363	BAI32516.1	serine protease autotransporter EspI	NA	NA
S1172_CU0358_IS03	EOKFEKHF_04557	NODE_51_length_12905_cov_69.101809	73	507	-	merR	mercury resistance transcriptional regulator MerR	plus	STRESS	METAL	MERCURY	MERCURY	BLASTP	144	144	100.00	93.75	144	CAA77320.1	mercury resistance transcriptional regulator MerR	NF010315.0	mercury resistance transcriptional regulator MerR
S1172_CU0358_IS03	EOKFEKHF_04558	NODE_51_length_12905_cov_69.101809	579	929	+	merT	mercuric transport protein MerT	plus	STRESS	METAL	MERCURY	MERCURY	EXACTP	116	116	100.00	100.00	116	AAB59075.1	mercuric transport protein MerT	NA	NA
S1172_CU0358_IS03	EOKFEKHF_04559	NODE_51_length_12905_cov_69.101809	943	1218	+	merP	mercury resistance system periplasmic binding protein MerP	plus	STRESS	METAL	MERCURY	MERCURY	BLASTP	91	91	100.00	90.11	91	AAC38219.1	mercury resistance system periplasmic binding protein MerP	TIGR02052.1	mercury resistance system periplasmic binding protein MerP
S1172_CU0358_IS03	EOKFEKHF_04560	NODE_51_length_12905_cov_69.101809	1254	1676	+	merC	organomercurial transporter MerC	plus	STRESS	METAL	MERCURY	ORGANOMERCURY	BLASTP	140	140	100.00	99.29	140	AAC33908.1	organomercurial transporter MerC	NF033784.1	organomercurial transporter MerC
S1172_CU0358_IS03	EOKFEKHF_04561	NODE_51_length_12905_cov_69.101809	1728	3422	+	merA	mercury(II) reductase	plus	STRESS	METAL	MERCURY	MERCURY	HMM	564	561	100.00	85.31	565	AAC38220.1	mercury(II) reductase	TIGR02053.1	mercury(II) reductase
S1172_CU0358_IS03	EOKFEKHF_04562	NODE_51_length_12905_cov_69.101809	3440	3802	+	merD	mercury resistance co-regulator MerD	plus	STRESS	METAL	MERCURY	MERCURY	HMM	120	121	100.00	82.64	121	AAC38221.1	mercury resistance co-regulator MerD	NF033783.1	mercury resistance co-regulator MerD
S1172_CU0358_IS03	EOKFEKHF_04563	NODE_51_length_12905_cov_69.101809	3799	4035	+	merE	broad-spectrum mercury transporter MerE	plus	STRESS	METAL	MERCURY	MERCURY	HMM	78	78	100.00	78.21	78	AAA88371.1	broad-spectrum mercury transporter MerE	NF010310.2	broad-spectrum mercury transporter MerE
S1172_CU0358_IS03	EOKFEKHF_04567	NODE_51_length_12905_cov_69.101809	6955	7860	+	mph(A)	Mph(A) family macrolide 2'-phosphotransferase	core	AMR	AMR	MACROLIDE	MACROLIDE	EXACTP	301	301	100.00	100.00	301	WP_000219391.1	Mph(A) family macrolide 2'-phosphotransferase	NF000254.1	Mph(A) family macrolide 2'-phosphotransferase
S1172_CU0358_IS03	EOKFEKHF_04592	NODE_53_length_10044_cov_77.976021	3536	7654	-	pic	serine protease autotransporter toxin Pic	plus	VIRULENCE	VIRULENCE	NA	NA	EXACTP	1372	1372	100.00	100.00	1372	CAU99295.1	serine protease autotransporter toxin Pic	NA	NA
S1172_CU0358_IS03	NA	NODE_54_length_7261_cov_91.221186	133	921	-	aadA2	ANT(3'')-Ia family aminoglycoside nucleotidyltransferase AadA2	core	AMR	AMR	AMINOGLYCOSIDE	STREPTOMYCIN	EXACTX	263	263	100.00	100.00	263	WP_001206356.1	ANT(3'')-Ia family aminoglycoside nucleotidyltransferase AadA2	NF012157.0	ANT(3'')-I family aminoglycoside nucleotidyltransferase
S1172_CU0358_IS03	EOKFEKHF_04596	NODE_54_length_7261_cov_91.221186	1329	1826	-	dfrA12	trimethoprim-resistant dihydrofolate reductase DfrA12	core	AMR	AMR	TRIMETHOPRIM	TRIMETHOPRIM	EXACTP	165	165	100.00	100.00	165	WP_001083725.1	trimethoprim-resistant dihydrofolate reductase DfrA12	NF000053.2	trimethoprim-resistant dihydrofolate reductase DfrA12
S1172_CU0358_IS03	NA	NODE_67_length_2776_cov_710.424602	1020	1661	-	qnrB19	quinolone resistance pentapeptide repeat protein QnrB19	core	AMR	AMR	QUINOLONE	QUINOLONE	ALLELEX	214	214	100.00	100.00	214	WP_012954666.1	quinolone resistance pentapeptide repeat protein QnrB19	NF000420.1	QnrB family quinolone resistance pentapeptide repeat protein
S1172_CU0358_IS03	EOKFEKHF_01298	NODE_6_length_231530_cov_57.873707	22921	23229	+	asr	acid resistance repetitive basic protein Asr	plus	STRESS	ACID	NA	NA	EXACTP	102	102	100.00	100.00	102	BAA15331.2	acid resistance repetitive basic protein Asr	NF033636.1	acid resistance repetitive basic protein Asr
S1172_CU0358_IS03	EOKFEKHF_04667	NODE_72_length_1597_cov_109.319737	112	459	+	qacEdelta1	quaternary ammonium compound efflux SMR transporter QacE delta 1	core	STRESS	BIOCIDE	QUATERNARY AMMONIUM	QUATERNARY AMMONIUM	ALLELEP	115	115	100.00	100.00	115	WP_000679427.1	quaternary ammonium compound efflux SMR transporter QacE delta 1	NF000276.2	quaternary ammonium compound efflux SMR transporter QacE
S1172_CU0358_IS03	EOKFEKHF_04668	NODE_72_length_1597_cov_109.319737	453	1292	+	sul1	sulfonamide-resistant dihydropteroate synthase Sul1	core	AMR	AMR	SULFONAMIDE	SULFONAMIDE	EXACTP	279	279	100.00	100.00	279	WP_000259031.1	sulfonamide-resistant dihydropteroate synthase Sul1	NF000294.1	sulfonamide-resistant dihydropteroate synthase Sul1
S1172_CU0358_IS03	EOKFEKHF_04672	NODE_74_length_1507_cov_74.835664	689	1348	-	catA1	type A-1 chloramphenicol O-acetyltransferase	core	AMR	AMR	PHENICOL	CHLORAMPHENICOL	EXACTP	219	219	100.00	100.00	219	WP_000412211.1	type A-1 chloramphenicol O-acetyltransferase	NF000491.1	type A chloramphenicol O-acetyltransferase
S1172_CU0358_IS03	EOKFEKHF_01622	NODE_7_length_208626_cov_59.240356	108366	108632	+	ymgB	biofilm/acid-resistance regulator AriR	plus	STRESS	ACID	NA	NA	EXACTP	88	88	100.00	100.00	88	AAC74250.1	biofilm/acid-resistance regulator AriR	NA	NA
S1172_CU0358_IS03	NA	NODE_82_length_1004_cov_53.481122	84	872	+	aadA1	ANT(3'')-Ia family aminoglycoside nucleotidyltransferase AadA1	core	AMR	AMR	AMINOGLYCOSIDE	STREPTOMYCIN	EXACTX	263	263	100.00	100.00	263	WP_001206316.1	ANT(3'')-Ia family aminoglycoside nucleotidyltransferase AadA1	NF033126.1	ANT(3'')-Ia family aminoglycoside nucleotidyltransferase AadA1
