Name	Protein identifier	Contig id	Start	Stop	Strand	Gene symbol	Sequence name	Scope	Element type	Element subtype	Class	Subclass	Method	Target length	Reference sequence length	% Coverage of reference sequence	% Identity to reference sequence	Alignment length	Accession of closest sequence	Name of closest sequence	HMM id	HMM description
11368	NJKBLL_00110	contig_1	20868	22289	-	espX1	type III secretion system effector EspX1	plus	VIRULENCE	VIRULENCE	NA	NA	BLASTP	473	473	100.00	91.12	473	ADD54679.1	type III secretion system effector EspX1	NA	NA
11368	NJKBLL_01760	contig_1	350981	355234	+	fdeC	intimin-like adhesin FdeC	plus	VIRULENCE	VIRULENCE	NA	NA	BLASTP	1417	1416	99.93	90.81	1415	ABE05822.1	intimin-like adhesin FdeC	NA	NA
11368	NJKBLL_03130	contig_1	629644	629937	-	iss	increased serum survival lipoprotein Iss	plus	VIRULENCE	VIRULENCE	NA	NA	EXACTP	97	97	100.00	100.00	97	CAR12622.1	increased serum survival lipoprotein Iss	NA	NA
11368	NJKBLL_04755	contig_1	935735	936562	+	cif	type III secretion system effector Cif	plus	VIRULENCE	VIRULENCE	NA	NA	BLASTP	275	282	97.16	99.27	274	AAQ07241.1	type III secretion system effector Cif	NA	NA
11368	NJKBLL_04790	contig_1	941682	942335	-	espJ	type III secretion system effector ADP-ribosyltransferase EspJ	plus	VIRULENCE	VIRULENCE	NA	NA	EXACTP	217	217	100.00	100.00	217	BAF96525.1	type III secretion system effector ADP-ribosyltransferase EspJ	NA	NA
11368	NJKBLL_06175	contig_1	1218825	1219577	-	tccP	Tir-cytoskeleton coupling protein TccP2	plus	VIRULENCE	VIRULENCE	NA	NA	BLASTP	250	250	100.00	98.00	250	BAF45439.1	Tir-cytoskeleton coupling protein TccP2	NA	NA
11368	NJKBLL_06895	contig_1	1325887	1326354	-	terW	tellurium resistance protein TerW	plus	STRESS	METAL	TELLURIUM	TELLURIUM	BLASTP	155	155	100.00	99.35	155	AAC44736.1	tellurium resistance protein TerW	NA	NA
11368	NJKBLL_06930	contig_1	1332927	1333508	+	terZ	tellurium resistance-associated protein TerZ	plus	STRESS	METAL	TELLURIUM	TELLURIUM	BLASTP	193	193	100.00	98.96	193	AAA86846.1	tellurium resistance-associated protein TerZ	NA	NA
11368	NJKBLL_06950	contig_1	1336255	1336833	+	terD	tellurium resistance membrane protein TerD	plus	STRESS	METAL	TELLURIUM	TELLURIUM	BLASTP	192	192	100.00	95.31	192	AAA98292.1	tellurium resistance membrane protein TerD	NA	NA
11368	NJKBLL_06965	contig_1	1338801	1340891	-	iha	bifunctional siderophore receptor/adhesin Iha	plus	VIRULENCE	VIRULENCE	NA	NA	EXACTP	696	696	100.00	100.00	696	AAG55323.1	bifunctional siderophore receptor/adhesin Iha	NA	NA
11368	NJKBLL_07100	contig_1	1363199	1364923	+	iucA	aerobactin synthase IucA	plus	VIRULENCE	VIRULENCE	NA	NA	BLASTP	574	576	100.00	98.61	576	EGI25746.1	aerobactin synthase IucA	NA	NA
11368	NJKBLL_07105	contig_1	1364924	1365871	+	iucB	N(6)-hydroxylysine O-acetyltransferase IucB	plus	VIRULENCE	VIRULENCE	NA	NA	EXACTP	315	315	100.00	100.00	315	AAN82074.1	N(6)-hydroxylysine O-acetyltransferase IucB	NA	NA
11368	NJKBLL_07110	contig_1	1365871	1367613	+	iucC	NIS family aerobactin synthetase IucC	plus	VIRULENCE	VIRULENCE	NA	NA	EXACTP	580	580	100.00	100.00	580	AAN82073.1	NIS family aerobactin synthetase IucC	NA	NA
11368	NJKBLL_07115	contig_1	1367610	1368947	+	iucD	NADPH-dependent L-lysine N(6)-monooxygenase IucD	plus	VIRULENCE	VIRULENCE	NA	NA	BLASTP	445	445	100.00	98.88	445	AAD44749.1	NADPH-dependent L-lysine N(6)-monooxygenase IucD	NA	NA
11368	NJKBLL_07120	contig_1	1368953	1371148	+	iutA	ferric aerobactin receptor IutA	plus	VIRULENCE	VIRULENCE	NA	NA	BLASTP	731	731	100.00	99.18	731	AAN45165.2	ferric aerobactin receptor IutA	NA	NA
11368	NJKBLL_08030	contig_1	1521799	1523160	-	espK	type III secretion system effector EspK	plus	VIRULENCE	VIRULENCE	NA	NA	BLASTP	453	453	100.00	95.58	453	BAB34991.1	type III secretion system effector EspK	NA	NA
11368	NJKBLL_08420	contig_1	1579484	1580431	+	stxA1a	Shiga toxin Stx1a subunit A	plus	VIRULENCE	VIRULENCE	STX1	STX1A	BLASTP	315	315	100.00	99.68	315	AAA71893.1	Shiga toxin Stx1a subunit A	NF033658.1	Shiga toxin Stx1 subunit A
11368	NJKBLL_08425	contig_1	1580441	1580710	+	stxB1a	Shiga toxin Stx1a subunit B	plus	VIRULENCE	VIRULENCE	STX1	STX1A	EXACTP	89	89	100.00	100.00	89	AAA71894.1	Shiga toxin Stx1a subunit B	NF033659.0	Shiga toxin Stx1 subunit B
11368	NJKBLL_08805	contig_1	1643397	1643663	+	ymgB	biofilm/acid-resistance regulator AriR	plus	STRESS	ACID	NA	NA	EXACTP	88	88	100.00	100.00	88	AAC74250.1	biofilm/acid-resistance regulator AriR	NA	NA
11368	NJKBLL_09510	contig_1	1763111	1764151	-	nleA	type III secretion system effector NleA	plus	VIRULENCE	VIRULENCE	NA	NA	PARTIALP	346	441	78.46	99.71	346	AAK16940.1	type III secretion system effector NleA	NA	NA
11368	NJKBLL_11610	contig_1	2171002	2171988	-	nleC	type III secretion system effector zinc metalloprotease NleC	plus	VIRULENCE	VIRULENCE	NA	NA	EXACTP	328	328	100.00	100.00	328	BAI25473.1	type III secretion system effector zinc metalloprotease NleC	NA	NA
11368	NJKBLL_12030	contig_1	2236461	2236769	+	asr	acid resistance repetitive basic protein Asr	plus	STRESS	ACID	NA	NA	BLASTP	102	102	100.00	98.04	102	BAA15331.2	acid resistance repetitive basic protein Asr	NF033636.1	acid resistance repetitive basic protein Asr
11368	NJKBLL_14990	contig_1	2757168	2758970	-	ybtQ	yersiniabactin ABC transporter ATP-binding/permease protein YbtQ	plus	VIRULENCE	VIRULENCE	NA	NA	BLASTP	600	600	100.00	99.50	600	AAC69584.1	yersiniabactin ABC transporter ATP-binding/permease protein YbtQ	NA	NA
11368	NJKBLL_14995	contig_1	2758957	2760669	-	ybtP	yersiniabactin ABC transporter ATP-binding/permease protein YbtP	plus	VIRULENCE	VIRULENCE	NA	NA	BLASTP	570	600	95.00	99.12	570	CAA21388.1	yersiniabactin ABC transporter ATP-binding/permease protein YbtP	NA	NA
11368	NJKBLL_16570	contig_1	3089728	3091050	+	nleA	type III secretion system effector NleA	plus	VIRULENCE	VIRULENCE	NA	NA	EXACTP	440	440	100.00	100.00	440	CAM11321.1	type III secretion system effector NleA	NA	NA
11368	NJKBLL_16725	contig_1	3117160	3117453	+	iss	increased serum survival lipoprotein Iss	plus	VIRULENCE	VIRULENCE	NA	NA	EXACTP	97	97	100.00	100.00	97	CAR12622.1	increased serum survival lipoprotein Iss	NA	NA
11368	NJKBLL_19310	contig_1	3606081	3607442	+	espK	type III secretion system effector EspK	plus	VIRULENCE	VIRULENCE	NA	NA	BLASTP	453	453	100.00	90.51	453	BAB34991.1	type III secretion system effector EspK	NA	NA
11368	NJKBLL_21545	contig_1	4032151	4034241	+	iha	bifunctional siderophore receptor/adhesin Iha	plus	VIRULENCE	VIRULENCE	NA	NA	EXACTP	696	696	100.00	100.00	696	BAI27255.1	bifunctional siderophore receptor/adhesin Iha	NA	NA
11368	NJKBLL_23135	contig_1	4347084	4350188	+	acrF	multidrug efflux RND transporter permease subunit AcrF	plus	AMR	AMR	EFFLUX	EFFLUX	BLASTP	1034	1034	100.00	99.61	1034	AAC76298.1	multidrug efflux RND transporter permease subunit AcrF	NA	NA
11368	NJKBLL_24300	contig_1	4569008	4569361	+	arsR	As(III)-sensing metalloregulatory transcriptional repressor ArsR	plus	STRESS	METAL	ARSENIC	ARSENIC	EXACTP	117	117	100.00	100.00	117	BAE77793.1	As(III)-sensing metalloregulatory transcriptional repressor ArsR	NA	NA
11368	NJKBLL_24310	contig_1	4570717	4571142	+	arsC	glutaredoxin-dependent arsenate reductase	plus	STRESS	METAL	ARSENIC	ARSENATE	BLASTP	141	141	100.00	94.33	141	AAA21096.1	glutaredoxin-dependent arsenate reductase	NF007456.1	glutaredoxin-dependent arsenate reductase
11368	NJKBLL_24790	contig_1	4667752	4668654	-	fieF	CDF family cation-efflux transporter FieF	plus	STRESS	METAL	NA	NA	EXACTP	300	300	100.00	100.00	300	BAE77395.1	CDF family cation-efflux transporter FieF	NA	NA
11368	NJKBLL_25845	contig_1	4871964	4872536	+	lpfA	long polar fimbria major subunit LpfA-O113	plus	VIRULENCE	VIRULENCE	NA	NA	EXACTP	190	190	100.00	100.00	190	AAT76975.1	long polar fimbria major subunit LpfA-O113	NA	NA
11368	NJKBLL_26160	contig_1	4933531	4934715	-	emrD	multidrug efflux MFS transporter EmrD	plus	AMR	AMR	EFFLUX	EFFLUX	EXACTP	394	394	100.00	100.00	394	BAE77620.1	multidrug efflux MFS transporter EmrD	NA	NA
11368	NJKBLL_26940	contig_1	5094672	5095196	+	lpfA	long polar fimbria major subunit LpfA	plus	VIRULENCE	VIRULENCE	NA	NA	EXACTP	174	174	100.00	100.00	174	CAV00478.1	long polar fimbria major subunit LpfA	NA	NA
11368	NJKBLL_28230	contig_1	5352385	5354001	+	tir	type III secretion system LEE translocated intimin receptor Tir	plus	VIRULENCE	VIRULENCE	NA	NA	BLASTP	538	538	100.00	99.81	538	AAC15683.1	type III secretion system LEE translocated intimin receptor Tir	NF033637.1	type III secretion system LEE translocated intimin receptor Tir
11368	NJKBLL_28240	contig_1	5354665	5357484	+	eae	intimin type beta	plus	VIRULENCE	VIRULENCE	INTIMIN	BETA	EXACTP	939	939	100.00	100.00	939	ACM67157.1	intimin type beta	NF033627.3	intimin
11368	NJKBLL_28255	contig_1	5360175	5360753	+	espA	type III secretion system LEE translocon filament protein EspA	plus	VIRULENCE	VIRULENCE	NA	NA	EXACTP	192	192	100.00	100.00	192	CAR47993.1	type III secretion system LEE translocon filament protein EspA	NA	NA
11368	NJKBLL_28265	contig_1	5361929	5362873	+	espB	type III secretion system LEE translocon pore-forming subunit EspB	plus	VIRULENCE	VIRULENCE	NA	NA	EXACTP	314	314	100.00	100.00	314	AAC82360.1	type III secretion system LEE translocon pore-forming subunit EspB	NA	NA
11368	NJKBLL_28285	contig_1	5364045	5364668	+	espF	type III secretion system LEE effector EspF	plus	VIRULENCE	VIRULENCE	NA	NA	EXACTP	207	207	100.00	100.00	207	AAF03351.1	type III secretion system LEE effector EspF	NF040807.1	type III secretion system LEE effector EspF
11368	NJKBLL_28300	contig_1	5365603	5375274	-	efa1	lymphostatin Efa1/LifA	plus	VIRULENCE	VIRULENCE	NA	NA	EXACTP	3223	3223	100.00	100.00	3223	CAC81883.1	lymphostatin Efa1/LifA	NA	NA
11368	NJKBLL_28315	contig_1	5377875	5378864	-	nleB	type III secretion system effector arginine glycosyltransferase NleB	plus	VIRULENCE	VIRULENCE	NA	NA	EXACTP	329	329	100.00	100.00	329	AAL57565.1	type III secretion system effector arginine glycosyltransferase NleB	NA	NA
11368	NJKBLL_28445	contig_1	5404091	5405224	-	blaEC	BlaEC family class C beta-lactamase	plus	AMR	AMR	BETA-LACTAM	BETA-LACTAM	BLASTP	377	377	100.00	98.67	377	WP_063610930.1	extended-spectrum class C beta-lactamase EC-15	NF000185.2	BlaEC family class C beta-lactamase
11368	NJKBLL_29605	contig_1	5614664	5615896	-	mdtM	multidrug efflux MFS transporter MdtM	plus	AMR	AMR	EFFLUX	EFFLUX	BLASTP	410	410	100.00	97.80	410	AAC77293.1	multidrug efflux MFS transporter MdtM	NA	NA
