Name	Protein identifier	Contig id	Start	Stop	Strand	Gene symbol	Sequence name	Scope	Element type	Element subtype	Class	Subclass	Method	Target length	Reference sequence length	% Coverage of reference sequence	% Identity to reference sequence	Alignment length	Accession of closest sequence	Name of closest sequence	HMM id	HMM description
61-0091-ETEC-V1-col7A	MBPPFE_00960	contig_1	201047	202156	+	espX1	type III secretion system effector EspX1	plus	VIRULENCE	VIRULENCE	NA	NA	PARTIALP	369	473	75.69	89.39	358	ADD54679.1	type III secretion system effector EspX1	NA	NA
61-0091-ETEC-V1-col7A	MBPPFE_12635	contig_13	124583	125716	+	blaEC	BlaEC family class C beta-lactamase	plus	AMR	AMR	BETA-LACTAM	BETA-LACTAM	BLASTP	377	377	100.00	98.41	377	WP_063610930.1	extended-spectrum class C beta-lactamase EC-15	NF000185.2	BlaEC family class C beta-lactamase
61-0091-ETEC-V1-col7A	MBPPFE_13895	contig_15	100338	100646	-	asr	acid resistance repetitive basic protein Asr	plus	STRESS	ACID	NA	NA	BLASTP	102	102	100.00	98.04	102	BAA15331.2	acid resistance repetitive basic protein Asr	NF033636.1	acid resistance repetitive basic protein Asr
61-0091-ETEC-V1-col7A	MBPPFE_14995	contig_17	71653	75909	-	fdeC	intimin-like adhesin FdeC	plus	VIRULENCE	VIRULENCE	NA	NA	BLASTP	1418	1416	100.00	94.21	1416	ABE05822.1	intimin-like adhesin FdeC	NA	NA
61-0091-ETEC-V1-col7A	MBPPFE_16935	contig_21	65362	66264	+	fieF	CDF family cation-efflux transporter FieF	plus	STRESS	METAL	NA	NA	BLASTP	300	300	100.00	99.67	300	BAE77395.1	CDF family cation-efflux transporter FieF	NA	NA
61-0091-ETEC-V1-col7A	MBPPFE_18815	contig_26	28438	29670	-	mdtM	multidrug efflux MFS transporter MdtM	plus	AMR	AMR	EFFLUX	EFFLUX	BLASTP	410	410	100.00	97.80	410	AAC77293.1	multidrug efflux MFS transporter MdtM	NA	NA
61-0091-ETEC-V1-col7A	MBPPFE_21995	contig_38	31233	31499	+	ymgB	biofilm/acid-resistance regulator AriR	plus	STRESS	ACID	NA	NA	EXACTP	88	88	100.00	100.00	88	AAC74250.1	biofilm/acid-resistance regulator AriR	NA	NA
61-0091-ETEC-V1-col7A	MBPPFE_22315	contig_40	29996	30568	+	lpfA	long polar fimbria major subunit LpfA-O113	plus	VIRULENCE	VIRULENCE	NA	NA	EXACTP	190	190	100.00	100.00	190	AAT76975.1	long polar fimbria major subunit LpfA-O113	NA	NA
61-0091-ETEC-V1-col7A	MBPPFE_22790	contig_44	5336	6541	+	tet(B)	tetracycline efflux MFS transporter Tet(B)	core	AMR	AMR	TETRACYCLINE	TETRACYCLINE	BLASTP	401	401	100.00	99.75	401	WP_001089068.1	tetracycline efflux MFS transporter Tet(B)	NF012190.1	tetracycline efflux MFS transporter Tet(B)
61-0091-ETEC-V1-col7A	MBPPFE_22860	contig_44	16404	16913	-	dfrA8	trimethoprim-resistant dihydrofolate reductase DfrA8	core	AMR	AMR	TRIMETHOPRIM	TRIMETHOPRIM	EXACTP	169	169	100.00	100.00	169	WP_000571065.1	trimethoprim-resistant dihydrofolate reductase DfrA8	NF000126.2	trimethoprim-resistant dihydrofolate reductase DfrA8
61-0091-ETEC-V1-col7A	MBPPFE_22870	contig_44	18004	18864	+	blaTEM-1	broad-spectrum class A beta-lactamase TEM-1	core	AMR	AMR	BETA-LACTAM	BETA-LACTAM	ALLELEP	286	286	100.00	100.00	286	WP_000027057.1	broad-spectrum class A beta-lactamase TEM-1	NF000531.2	TEM family class A beta-lactamase
61-0091-ETEC-V1-col7A	MBPPFE_22890	contig_44	20367	21182	+	sul2	sulfonamide-resistant dihydropteroate synthase Sul2	core	AMR	AMR	SULFONAMIDE	SULFONAMIDE	EXACTP	271	271	100.00	100.00	271	WP_001043260.1	sulfonamide-resistant dihydropteroate synthase Sul2	NF000295.1	sulfonamide-resistant dihydropteroate synthase Sul2
61-0091-ETEC-V1-col7A	MBPPFE_22895	contig_44	21243	22046	+	aph(3'')-Ib	aminoglycoside O-phosphotransferase APH(3'')-Ib	core	AMR	AMR	AMINOGLYCOSIDE	STREPTOMYCIN	EXACTP	267	267	100.00	100.00	267	WP_001082319.1	aminoglycoside O-phosphotransferase APH(3'')-Ib	NF032895.1	aminoglycoside O-phosphotransferase APH(3'')-Ib
61-0091-ETEC-V1-col7A	MBPPFE_22900	contig_44	22046	22882	+	aph(6)-Id	aminoglycoside O-phosphotransferase APH(6)-Id	core	AMR	AMR	AMINOGLYCOSIDE	STREPTOMYCIN	EXACTP	278	278	100.00	100.00	278	WP_000480972.1	aminoglycoside O-phosphotransferase APH(6)-Id	NF012171.0	APH(6)-I family aminoglycoside O-phosphotransferase
61-0091-ETEC-V1-col7A	NA	contig_46	21943	22272	+	emrE	multidrug efflux SMR transporter EmrE	plus	STRESS	BIOCIDE	EFFLUX	EFFLUX	INTERNAL_STOP	110	110	100.00	96.36	110	CAA77936.1	multidrug efflux SMR transporter EmrE	NA	NA
61-0091-ETEC-V1-col7A	MBPPFE_05570	contig_5	137608	142173	-	sslE	lipoprotein metalloprotease SslE	plus	VIRULENCE	VIRULENCE	NA	NA	HMM	1521	1520	100.00	87.71	1522	ADE89421.1	lipoprotein metalloprotease SslE	NF037973.1	lipoprotein metalloprotease SslE
61-0091-ETEC-V1-col7A	MBPPFE_23860	contig_54	6911	7999	+	capU	putative hexosyltransferase CapU	plus	VIRULENCE	VIRULENCE	NA	NA	BLASTP	362	362	100.00	99.45	362	CBL93318.1	putative hexosyltransferase CapU	NA	NA
61-0091-ETEC-V1-col7A	NA	contig_56	550	663	+	astA	heat-stable enterotoxin EAST1	plus	VIRULENCE	VIRULENCE	NA	NA	EXACTX	38	38	100.00	100.00	38	AAM88299.1	heat-stable enterotoxin EAST1	NA	NA
61-0091-ETEC-V1-col7A	MBPPFE_24155	contig_59	2548	3204	+	ltcA	heat-labile enterotoxin LT subunit A	plus	VIRULENCE	VIRULENCE	NA	NA	PARTIALP	218	258	84.50	99.08	218	ABV01310.1	heat-labile enterotoxin LT subunit A	NA	NA
61-0091-ETEC-V1-col7A	MBPPFE_07810	contig_7	172213	172566	+	arsR	As(III)-sensing metalloregulatory transcriptional repressor ArsR	plus	STRESS	METAL	ARSENIC	ARSENIC	EXACTP	117	117	100.00	100.00	117	BAE77793.1	As(III)-sensing metalloregulatory transcriptional repressor ArsR	NA	NA
61-0091-ETEC-V1-col7A	MBPPFE_07820	contig_7	173922	174347	+	arsC	glutaredoxin-dependent arsenate reductase	plus	STRESS	METAL	ARSENIC	ARSENATE	BLASTP	141	141	100.00	92.91	141	AAA21096.1	glutaredoxin-dependent arsenate reductase	NF007456.1	glutaredoxin-dependent arsenate reductase
61-0091-ETEC-V1-col7A	MBPPFE_08830	contig_8	176574	179678	+	acrF	multidrug efflux RND transporter permease subunit AcrF	plus	AMR	AMR	EFFLUX	EFFLUX	BLASTP	1034	1034	100.00	99.61	1034	AAC76298.1	multidrug efflux RND transporter permease subunit AcrF	NA	NA
61-0091-ETEC-V1-col7A	MBPPFE_09425	contig_9	122191	123375	+	emrD	multidrug efflux MFS transporter EmrD	plus	AMR	AMR	EFFLUX	EFFLUX	EXACTP	394	394	100.00	100.00	394	BAE77620.1	multidrug efflux MFS transporter EmrD	NA	NA
