Name	Protein identifier	Contig id	Start	Stop	Strand	Gene symbol	Sequence name	Scope	Element type	Element subtype	Class	Subclass	Method	Target length	Reference sequence length	% Coverage of reference sequence	% Identity to reference sequence	Alignment length	Accession of closest sequence	Name of closest sequence	HMM id	HMM description
921A	PKNDIP_00265	contig_1	62412	63545	-	blaEC	BlaEC family class C beta-lactamase	plus	AMR	AMR	BETA-LACTAM	BETA-LACTAM	BLASTP	377	377	100.00	97.88	377	AAZ85968.1	cephalosporin-hydrolyzing class C beta-lactamase EC-8	NF000185.2	BlaEC family class C beta-lactamase
921A	PKNDIP_01150	contig_1	234650	235882	-	mdtM	multidrug efflux MFS transporter MdtM	plus	AMR	AMR	EFFLUX	EFFLUX	BLASTP	410	410	100.00	97.80	410	AAC77293.1	multidrug efflux MFS transporter MdtM	NA	NA
921A	PKNDIP_09805	contig_12	69378	70280	-	fieF	CDF family cation-efflux transporter FieF	plus	STRESS	METAL	NA	NA	EXACTP	300	300	100.00	100.00	300	BAE77395.1	CDF family cation-efflux transporter FieF	NA	NA
921A	PKNDIP_11090	contig_14	78595	82845	-	fdeC	intimin-like adhesin FdeC	plus	VIRULENCE	VIRULENCE	NA	NA	BLASTP	1416	1416	100.00	95.69	1416	ABE05822.1	intimin-like adhesin FdeC	NA	NA
921A	PKNDIP_02195	contig_2	183925	187782	+	sigA	serine protease autotransporter toxin SigA	plus	VIRULENCE	VIRULENCE	NA	NA	BLASTP	1285	1285	100.00	99.92	1285	AAN44449.1	serine protease autotransporter toxin SigA	NA	NA
921A	PKNDIP_02240	contig_2	194042	196132	-	iha	bifunctional siderophore receptor/adhesin Iha	plus	VIRULENCE	VIRULENCE	NA	NA	EXACTP	696	696	100.00	100.00	696	AAG55323.1	bifunctional siderophore receptor/adhesin Iha	NA	NA
921A	PKNDIP_02255	contig_2	199587	201782	-	iutA	ferric aerobactin receptor IutA	plus	VIRULENCE	VIRULENCE	NA	NA	BLASTP	731	731	100.00	99.59	731	AAN45165.2	ferric aerobactin receptor IutA	NA	NA
921A	PKNDIP_02260	contig_2	201788	203125	-	iucD	NADPH-dependent L-lysine N(6)-monooxygenase IucD	plus	VIRULENCE	VIRULENCE	NA	NA	BLASTP	445	445	100.00	99.78	445	AAD44749.1	NADPH-dependent L-lysine N(6)-monooxygenase IucD	NA	NA
921A	PKNDIP_02265	contig_2	203122	204864	-	iucC	NIS family aerobactin synthetase IucC	plus	VIRULENCE	VIRULENCE	NA	NA	BLASTP	580	580	100.00	99.48	580	AAN82073.1	NIS family aerobactin synthetase IucC	NA	NA
921A	PKNDIP_02270	contig_2	204864	205811	-	iucB	N(6)-hydroxylysine O-acetyltransferase IucB	plus	VIRULENCE	VIRULENCE	NA	NA	BLASTP	315	315	100.00	99.37	315	AAN82074.1	N(6)-hydroxylysine O-acetyltransferase IucB	NA	NA
921A	PKNDIP_02275	contig_2	205812	207536	-	iucA	aerobactin synthase IucA	plus	VIRULENCE	VIRULENCE	NA	NA	BLASTP	574	576	100.00	98.44	576	EGI25746.1	aerobactin synthase IucA	NA	NA
921A	PKNDIP_16105	contig_24	15911	20482	-	sslE	lipoprotein metalloprotease SslE	plus	VIRULENCE	VIRULENCE	NA	NA	BLASTP	1523	1520	100.00	92.98	1524	ADE89421.1	lipoprotein metalloprotease SslE	NF037973.1	lipoprotein metalloprotease SslE
921A	PKNDIP_18300	contig_29	55256	55522	-	ymgB	biofilm/acid-resistance regulator AriR	plus	STRESS	ACID	NA	NA	BLASTP	88	88	100.00	96.59	88	AAC74250.1	biofilm/acid-resistance regulator AriR	NA	NA
921A	PKNDIP_18555	contig_30	38139	38711	-	lpfA	long polar fimbria major subunit LpfA-O113	plus	VIRULENCE	VIRULENCE	NA	NA	EXACTP	190	190	100.00	100.00	190	ACB16424.1	long polar fimbria major subunit LpfA-O113	NA	NA
921A	PKNDIP_20300	contig_36	25190	25615	-	arsC	glutaredoxin-dependent arsenate reductase	plus	STRESS	METAL	ARSENIC	ARSENATE	BLASTP	141	141	100.00	93.62	141	AAA21096.1	glutaredoxin-dependent arsenate reductase	NF007456.1	glutaredoxin-dependent arsenate reductase
921A	PKNDIP_20310	contig_36	26972	27325	-	arsR	As(III)-sensing metalloregulatory transcriptional repressor ArsR	plus	STRESS	METAL	ARSENIC	ARSENIC	BLASTP	117	117	100.00	97.44	117	BAE77793.1	As(III)-sensing metalloregulatory transcriptional repressor ArsR	NA	NA
921A	PKNDIP_20850	contig_38	31549	34653	+	acrF	multidrug efflux RND transporter permease subunit AcrF	plus	AMR	AMR	EFFLUX	EFFLUX	BLASTP	1034	1034	100.00	99.52	1034	AAC76298.1	multidrug efflux RND transporter permease subunit AcrF	NA	NA
921A	PKNDIP_03850	contig_4	90239	92416	+	sinH	intimin-like inverse autotransporter SinH	plus	VIRULENCE	VIRULENCE	NA	NA	HMM	725	730	100.00	72.78	731	AAL21411.1	intimin-like inverse autotransporter SinH	NF033423.1	intimin-like inverse autotransporter SinH
921A	NA	contig_46	8374	9561	+	emrD	multidrug efflux MFS transporter EmrD	plus	AMR	AMR	EFFLUX	EFFLUX	EXACTX	396	396	100.00	100.00	396	EFF04178.1	multidrug efflux MFS transporter EmrD	NA	NA
921A	PKNDIP_24060	contig_62	5926	6765	-	sul1	sulfonamide-resistant dihydropteroate synthase Sul1	core	AMR	AMR	SULFONAMIDE	SULFONAMIDE	EXACTP	279	279	100.00	100.00	279	WP_000259031.1	sulfonamide-resistant dihydropteroate synthase Sul1	NF000294.1	sulfonamide-resistant dihydropteroate synthase Sul1
921A	PKNDIP_24065	contig_62	6759	7106	-	qacEdelta1	quaternary ammonium compound efflux SMR transporter QacE delta 1	core	STRESS	BIOCIDE	QUATERNARY AMMONIUM	QUATERNARY AMMONIUM	ALLELEP	115	115	100.00	100.00	115	WP_000679427.1	quaternary ammonium compound efflux SMR transporter QacE delta 1	NF000276.2	quaternary ammonium compound efflux SMR transporter QacE
921A	PKNDIP_24070	contig_62	7290	7763	-	dfrA5	trimethoprim-resistant dihydrofolate reductase DfrA5	core	AMR	AMR	TRIMETHOPRIM	TRIMETHOPRIM	EXACTP	157	157	100.00	100.00	157	WP_001317507.1	trimethoprim-resistant dihydrofolate reductase DfrA5	NF000330.1	trimethoprim-resistant dihydrofolate reductase DfrA
921A	PKNDIP_24305	contig_67	2671	2979	-	asr	acid resistance repetitive basic protein Asr	plus	STRESS	ACID	NA	NA	BLASTP	102	102	100.00	98.04	102	BAA15331.2	acid resistance repetitive basic protein Asr	NF033636.1	acid resistance repetitive basic protein Asr
921A	PKNDIP_24525	contig_73	560	2608	-	ireA	TonB-dependent siderophore receptor IreA	plus	VIRULENCE	VIRULENCE	NA	NA	BLASTP	682	682	100.00	99.56	682	AAN83596.1	TonB-dependent siderophore receptor IreA	NA	NA
