Name	Protein identifier	Contig id	Start	Stop	Strand	Gene symbol	Sequence name	Scope	Element type	Element subtype	Class	Subclass	Method	Target length	Reference sequence length	% Coverage of reference sequence	% Identity to reference sequence	Alignment length	Accession of closest sequence	Name of closest sequence	HMM id	HMM description
NA114	OHAGFC_01570	contig_1	315281	319528	+	fdeC	intimin-like adhesin FdeC	plus	VIRULENCE	VIRULENCE	NA	NA	BLASTP	1415	1416	100.00	96.75	1416	ABE05822.1	intimin-like adhesin FdeC	NA	NA
NA114	OHAGFC_08475	contig_1	1652407	1652715	+	asr	acid resistance repetitive basic protein Asr	plus	STRESS	ACID	NA	NA	BLASTP	102	102	100.00	98.04	102	BAA15331.2	acid resistance repetitive basic protein Asr	NF033636.1	acid resistance repetitive basic protein Asr
NA114	OHAGFC_10400	contig_1	2007886	2008218	-	emrE	multidrug efflux SMR transporter EmrE	plus	STRESS	BIOCIDE	EFFLUX	EFFLUX	BLASTP	110	110	100.00	98.18	110	CAA77936.1	multidrug efflux SMR transporter EmrE	NF000336.1	multidrug efflux SMR transporter EmrE
NA114	OHAGFC_10550	contig_1	2030601	2032403	-	ybtQ	yersiniabactin ABC transporter ATP-binding/permease protein YbtQ	plus	VIRULENCE	VIRULENCE	NA	NA	BLASTP	600	600	100.00	99.50	600	AAC69584.1	yersiniabactin ABC transporter ATP-binding/permease protein YbtQ	NA	NA
NA114	OHAGFC_10555	contig_1	2032390	2034102	-	ybtP	yersiniabactin ABC transporter ATP-binding/permease protein YbtP	plus	VIRULENCE	VIRULENCE	NA	NA	BLASTP	570	600	95.00	99.47	570	CAA21388.1	yersiniabactin ABC transporter ATP-binding/permease protein YbtP	NA	NA
NA114	OHAGFC_13370	contig_1	2640772	2642946	-	sinH	intimin-like inverse autotransporter SinH	plus	VIRULENCE	VIRULENCE	NA	NA	HMM	724	730	99.86	72.60	730	AAL21411.1	intimin-like inverse autotransporter SinH	NF033423.1	intimin-like inverse autotransporter SinH
NA114	OHAGFC_15715	contig_1	3125113	3129669	-	sslE	lipoprotein metalloprotease SslE	plus	VIRULENCE	VIRULENCE	NA	NA	HMM	1518	1520	100.00	86.59	1521	ADE89421.1	lipoprotein metalloprotease SslE	NF037973.1	lipoprotein metalloprotease SslE
NA114	OHAGFC_17210	contig_1	3430465	3433569	+	acrF	multidrug efflux RND transporter permease subunit AcrF	plus	AMR	AMR	EFFLUX	EFFLUX	BLASTP	1034	1034	100.00	99.52	1034	AAC76298.1	multidrug efflux RND transporter permease subunit AcrF	NA	NA
NA114	OHAGFC_18640	contig_1	3700950	3701375	+	arsC	glutaredoxin-dependent arsenate reductase	plus	STRESS	METAL	ARSENIC	ARSENATE	BLASTP	141	141	100.00	92.20	141	AAA21096.1	glutaredoxin-dependent arsenate reductase	NF007456.1	glutaredoxin-dependent arsenate reductase
NA114	OHAGFC_19725	contig_1	3936673	3937857	+	emrD	multidrug efflux MFS transporter EmrD	plus	AMR	AMR	EFFLUX	EFFLUX	BLASTP	394	394	100.00	98.98	394	BAE77620.1	multidrug efflux MFS transporter EmrD	NA	NA
NA114	OHAGFC_20980	contig_1	4168979	4169881	+	fieF	CDF family cation-efflux transporter FieF	plus	STRESS	METAL	NA	NA	BLASTP	300	300	100.00	99.67	300	BAE77395.1	CDF family cation-efflux transporter FieF	NA	NA
NA114	OHAGFC_22625	contig_1	4524688	4525692	-	blaEC	BlaEC family class C beta-lactamase	plus	AMR	AMR	BETA-LACTAM	BETA-LACTAM	PARTIALP	334	377	88.59	99.10	334	AAZ85965.1	cephalosporin-hydrolyzing class C beta-lactamase EC-5	NF012173.1	CMY2/MIR/ACT/EC family class C beta-lactamase
NA114	OHAGFC_23360	contig_1	4663147	4665237	-	iha	bifunctional siderophore receptor/adhesin Iha	plus	VIRULENCE	VIRULENCE	NA	NA	EXACTP	696	696	100.00	100.00	696	ADN47767.1	bifunctional siderophore receptor/adhesin Iha	NA	NA
NA114	OHAGFC_23520	contig_1	4692205	4694253	-	ireA	TonB-dependent siderophore receptor IreA	plus	VIRULENCE	VIRULENCE	NA	NA	EXACTP	682	682	100.00	100.00	682	ABJ02430.1	TonB-dependent siderophore receptor IreA	NA	NA
NA114	OHAGFC_23700	contig_1	4730647	4731879	-	mdtM	multidrug efflux MFS transporter MdtM	plus	AMR	AMR	EFFLUX	EFFLUX	BLASTP	410	410	100.00	97.07	410	AAC77293.1	multidrug efflux MFS transporter MdtM	NA	NA
NA114	OHAGFC_24115	contig_1	4811012	4811599	+	papH	P fimbrial minor subunit PapH	plus	VIRULENCE	VIRULENCE	NA	NA	BLASTP	195	195	100.00	98.46	195	CAA43563.1	P fimbrial minor subunit PapH	NA	NA
NA114	OHAGFC_24120	contig_1	4811649	4814168	+	papC	P fimbrial usher protein PapC	plus	VIRULENCE	VIRULENCE	NA	NA	BLASTP	839	836	100.00	96.20	841	CAA43564.1	P fimbrial usher protein PapC	NA	NA
NA114	OHAGFC_24145	contig_1	4816764	4817264	+	papF	P fimbrial tip protein PapF	plus	VIRULENCE	VIRULENCE	NA	NA	BLASTP	166	167	100.00	93.41	167	CAA43569.1	P fimbrial tip protein PapF	NA	NA
NA114	OHAGFC_24150	contig_1	4817308	4818318	+	papG-II	P fimbria tip G-adhesin PapG-II	plus	VIRULENCE	VIRULENCE	NA	NA	BLASTP	336	337	100.00	97.92	337	AAA24293.1	P fimbria tip G-adhesin PapG-II	NA	NA
NA114	OHAGFC_24285	contig_1	4842430	4844631	-	iutA	ferric aerobactin receptor IutA	plus	VIRULENCE	VIRULENCE	NA	NA	BLASTP	733	731	99.73	89.85	729	AAN45165.2	ferric aerobactin receptor IutA	NA	NA
NA114	OHAGFC_24290	contig_1	4844713	4845990	-	iucD	NADPH-dependent L-lysine N(6)-monooxygenase IucD	plus	VIRULENCE	VIRULENCE	NA	NA	BLASTP	425	445	95.51	97.65	425	AAD44749.1	NADPH-dependent L-lysine N(6)-monooxygenase IucD	NA	NA
NA114	OHAGFC_24295	contig_1	4845987	4847729	-	iucC	NIS family aerobactin synthetase IucC	plus	VIRULENCE	VIRULENCE	NA	NA	BLASTP	580	580	100.00	99.14	580	AAN82073.1	NIS family aerobactin synthetase IucC	NA	NA
NA114	OHAGFC_24300	contig_1	4847729	4848676	-	iucB	N(6)-hydroxylysine O-acetyltransferase IucB	plus	VIRULENCE	VIRULENCE	NA	NA	BLASTP	315	315	100.00	99.37	315	AAN82074.1	N(6)-hydroxylysine O-acetyltransferase IucB	NA	NA
NA114	OHAGFC_24305	contig_1	4848677	4850401	-	iucA	aerobactin synthase IucA	plus	VIRULENCE	VIRULENCE	NA	NA	BLASTP	574	576	100.00	98.61	576	EGI25746.1	aerobactin synthase IucA	NA	NA
