Name	Protein identifier	Contig id	Start	Stop	Strand	Gene symbol	Sequence name	Scope	Element type	Element subtype	Class	Subclass	Method	Target length	Reference sequence length	% Coverage of reference sequence	% Identity to reference sequence	Alignment length	Accession of closest sequence	Name of closest sequence	HMM id	HMM description
S1061_CU0679_IS05	IDPOOE_06830	contig_10	99405	100538	+	blaEC	BlaEC family class C beta-lactamase	plus	AMR	AMR	BETA-LACTAM	BETA-LACTAM	BLASTP	377	377	100.00	97.61	377	WP_063610930.1	extended-spectrum class C beta-lactamase EC-15	NF000185.2	BlaEC family class C beta-lactamase
S1061_CU0679_IS05	IDPOOE_23495	contig_114	1471	5370	+	espP	serine protease autotransporter EspP	plus	VIRULENCE	VIRULENCE	NA	NA	BLASTP	1299	1300	100.00	97.92	1300	BAA31836.1	serine protease autotransporter EspP	NA	NA
S1061_CU0679_IS05	IDPOOE_23855	contig_126	1456	1722	+	ymgB	biofilm/acid-resistance regulator AriR	plus	STRESS	ACID	NA	NA	EXACTP	88	88	100.00	100.00	88	AAC74250.1	biofilm/acid-resistance regulator AriR	NA	NA
S1061_CU0679_IS05	IDPOOE_24660	contig_164	908	1708	-	nleC	type III secretion system effector zinc metalloprotease NleC	plus	VIRULENCE	VIRULENCE	NA	NA	PARTIALP	266	328	80.18	99.24	263	BAI25473.1	type III secretion system effector zinc metalloprotease NleC	NA	NA
S1061_CU0679_IS05	IDPOOE_12380	contig_24	5200	8304	-	acrF	multidrug efflux RND transporter permease subunit AcrF	plus	AMR	AMR	EFFLUX	EFFLUX	BLASTP	1034	1034	100.00	99.71	1034	AAC76298.1	multidrug efflux RND transporter permease subunit AcrF	NA	NA
S1061_CU0679_IS05	IDPOOE_12755	contig_25	42909	44711	+	ybtP	yersiniabactin ABC transporter ATP-binding/permease protein YbtP	plus	VIRULENCE	VIRULENCE	NA	NA	BLASTP	600	600	100.00	99.67	600	CAA21388.1	yersiniabactin ABC transporter ATP-binding/permease protein YbtP	NA	NA
S1061_CU0679_IS05	IDPOOE_12760	contig_25	44698	46500	+	ybtQ	yersiniabactin ABC transporter ATP-binding/permease protein YbtQ	plus	VIRULENCE	VIRULENCE	NA	NA	BLASTP	600	600	100.00	99.67	600	AAC69584.1	yersiniabactin ABC transporter ATP-binding/permease protein YbtQ	NA	NA
S1061_CU0679_IS05	IDPOOE_14050	contig_30	40473	41363	-	espF	type III secretion system LEE effector EspF	plus	VIRULENCE	VIRULENCE	NA	NA	HMM	296	294	98.64	75.52	290	CAI43856.1	type III secretion system LEE effector EspF	NF040807.1	type III secretion system LEE effector EspF
S1061_CU0679_IS05	IDPOOE_14070	contig_30	42402	43367	-	espB	type III secretion system LEE translocon pore-forming subunit EspB	plus	VIRULENCE	VIRULENCE	NA	NA	EXACTP	321	321	100.00	100.00	321	AAC38396.1	type III secretion system LEE translocon pore-forming subunit EspB	NA	NA
S1061_CU0679_IS05	IDPOOE_14080	contig_30	44540	45112	-	espA	type III secretion system LEE translocon filament protein EspA	plus	VIRULENCE	VIRULENCE	NA	NA	BLASTP	190	190	100.00	98.95	190	CAA12346.1	type III secretion system LEE translocon filament protein EspA	NA	NA
S1061_CU0679_IS05	IDPOOE_15630	contig_37	38994	39659	+	tccP	Tir-cytoskeleton coupling protein TccP2	plus	VIRULENCE	VIRULENCE	NA	NA	PARTIALP	221	344	51.16	98.86	176	BAF52366.1	Tir-cytoskeleton coupling protein TccP2	NA	NA
S1061_CU0679_IS05	NA	contig_4	130535	131686	+	espX1	type III secretion system effector EspX1	plus	VIRULENCE	VIRULENCE	NA	NA	PARTIALX	384	473	81.18	90.36	384	ADD54679.1	type III secretion system effector EspX1	NA	NA
S1061_CU0679_IS05	IDPOOE_16945	contig_44	13945	14253	-	asr	acid resistance repetitive basic protein Asr	plus	STRESS	ACID	NA	NA	EXACTP	102	102	100.00	100.00	102	BAA15331.2	acid resistance repetitive basic protein Asr	NF033636.1	acid resistance repetitive basic protein Asr
S1061_CU0679_IS05	IDPOOE_17700	contig_49	240	3059	-	eae	intimin type kappa	plus	VIRULENCE	VIRULENCE	INTIMIN	KAPPA	BLASTP	939	939	100.00	99.89	939	ABF69110.1	intimin type kappa	NF033627.3	intimin
S1061_CU0679_IS05	IDPOOE_17710	contig_49	3722	5377	-	tir	type III secretion system LEE translocated intimin receptor Tir	plus	VIRULENCE	VIRULENCE	NA	NA	BLASTP	551	552	100.00	95.83	552	BAA96815.1	type III secretion system LEE translocated intimin receptor Tir	NF033637.1	type III secretion system LEE translocated intimin receptor Tir
S1061_CU0679_IS05	IDPOOE_18790	contig_56	3103	7359	+	fdeC	intimin-like adhesin FdeC	plus	VIRULENCE	VIRULENCE	NA	NA	BLASTP	1418	1416	100.00	94.07	1416	ABE05822.1	intimin-like adhesin FdeC	NA	NA
S1061_CU0679_IS05	IDPOOE_19070	contig_58	13156	14340	+	emrD	multidrug efflux MFS transporter EmrD	plus	AMR	AMR	EFFLUX	EFFLUX	BLASTP	394	394	100.00	99.49	394	BAE77620.1	multidrug efflux MFS transporter EmrD	NA	NA
S1061_CU0679_IS05	IDPOOE_04230	contig_6	71489	72391	+	fieF	CDF family cation-efflux transporter FieF	plus	STRESS	METAL	NA	NA	EXACTP	300	300	100.00	100.00	300	BAE77395.1	CDF family cation-efflux transporter FieF	NA	NA
S1061_CU0679_IS05	IDPOOE_19405	contig_60	22907	23260	+	arsR	As(III)-sensing metalloregulatory transcriptional repressor ArsR	plus	STRESS	METAL	ARSENIC	ARSENIC	EXACTP	117	117	100.00	100.00	117	BAE77793.1	As(III)-sensing metalloregulatory transcriptional repressor ArsR	NA	NA
S1061_CU0679_IS05	IDPOOE_19415	contig_60	24616	25041	+	arsC	glutaredoxin-dependent arsenate reductase	plus	STRESS	METAL	ARSENIC	ARSENATE	BLASTP	141	141	100.00	94.33	141	AAA21096.1	glutaredoxin-dependent arsenate reductase	NF007456.1	glutaredoxin-dependent arsenate reductase
S1061_CU0679_IS05	IDPOOE_19955	contig_64	321	4412	-	espI	serine protease autotransporter EspI	plus	VIRULENCE	VIRULENCE	NA	NA	BLASTP	1363	1363	100.00	99.93	1363	BAI32516.1	serine protease autotransporter EspI	NA	NA
S1061_CU0679_IS05	IDPOOE_21710	contig_81	1181	2413	+	mdtM	multidrug efflux MFS transporter MdtM	plus	AMR	AMR	EFFLUX	EFFLUX	BLASTP	410	410	100.00	99.76	410	AAC77293.1	multidrug efflux MFS transporter MdtM	NA	NA
S1061_CU0679_IS05	IDPOOE_22485	contig_93	1475	4471	+	ehxA	enterohemolysin EhxA	plus	VIRULENCE	VIRULENCE	NA	NA	BLASTP	998	998	100.00	99.70	998	ABQ02443.1	enterohemolysin EhxA	NA	NA
