Name	Protein identifier	Contig id	Start	Stop	Strand	Gene symbol	Sequence name	Scope	Element type	Element subtype	Class	Subclass	Method	Target length	Reference sequence length	% Coverage of reference sequence	% Identity to reference sequence	Alignment length	Accession of closest sequence	Name of closest sequence	HMM id	HMM description
S1128_CU0125_IS03	DHLMFL_00155	contig_1	46458	48170	+	ybtP	yersiniabactin ABC transporter ATP-binding/permease protein YbtP	plus	VIRULENCE	VIRULENCE	NA	NA	BLASTP	570	600	95.00	99.65	570	CAA21388.1	yersiniabactin ABC transporter ATP-binding/permease protein YbtP	NA	NA
S1128_CU0125_IS03	DHLMFL_00160	contig_1	48157	49959	+	ybtQ	yersiniabactin ABC transporter ATP-binding/permease protein YbtQ	plus	VIRULENCE	VIRULENCE	NA	NA	BLASTP	600	600	100.00	99.50	600	AAC69584.1	yersiniabactin ABC transporter ATP-binding/permease protein YbtQ	NA	NA
S1128_CU0125_IS03	DHLMFL_00385	contig_1	86366	86698	+	emrE	multidrug efflux SMR transporter EmrE	plus	STRESS	BIOCIDE	EFFLUX	EFFLUX	BLASTP	110	110	100.00	98.18	110	CAA77936.1	multidrug efflux SMR transporter EmrE	NF000336.1	multidrug efflux SMR transporter EmrE
S1128_CU0125_IS03	NA	contig_110	214	327	-	astA	heat-stable enterotoxin EAST1	plus	VIRULENCE	VIRULENCE	NA	NA	EXACTX	38	38	100.00	100.00	38	AAM88299.1	heat-stable enterotoxin EAST1	NA	NA
S1128_CU0125_IS03	DHLMFL_12215	contig_13	121988	125092	+	acrF	multidrug efflux RND transporter permease subunit AcrF	plus	AMR	AMR	EFFLUX	EFFLUX	EXACTP	1034	1034	100.00	100.00	1034	AAC76298.1	multidrug efflux RND transporter permease subunit AcrF	NA	NA
S1128_CU0125_IS03	DHLMFL_13760	contig_16	59105	60007	-	fieF	CDF family cation-efflux transporter FieF	plus	STRESS	METAL	NA	NA	EXACTP	300	300	100.00	100.00	300	BAE77395.1	CDF family cation-efflux transporter FieF	NA	NA
S1128_CU0125_IS03	DHLMFL_14830	contig_18	23847	25031	+	emrD	multidrug efflux MFS transporter EmrD	plus	AMR	AMR	EFFLUX	EFFLUX	EXACTP	394	394	100.00	100.00	394	BAE77620.1	multidrug efflux MFS transporter EmrD	NA	NA
S1128_CU0125_IS03	DHLMFL_18620	contig_27	335	1567	+	mdtM	multidrug efflux MFS transporter MdtM	plus	AMR	AMR	EFFLUX	EFFLUX	BLASTP	410	410	100.00	97.80	410	AAC77293.1	multidrug efflux MFS transporter MdtM	NA	NA
S1128_CU0125_IS03	DHLMFL_04025	contig_3	209965	213003	-	fdeC	intimin-like adhesin FdeC	plus	VIRULENCE	VIRULENCE	NA	NA	PARTIALP	1012	1416	71.47	95.75	1012	ABE05822.1	intimin-like adhesin FdeC	NA	NA
S1128_CU0125_IS03	DHLMFL_19920	contig_31	5806	6099	+	iss	increased serum survival lipoprotein Iss	plus	VIRULENCE	VIRULENCE	NA	NA	EXACTP	97	97	100.00	100.00	97	BAG76115.1	increased serum survival lipoprotein Iss	NA	NA
S1128_CU0125_IS03	NA	contig_34	10981	11205	+	mchB	microcin H47	plus	VIRULENCE	VIRULENCE	NA	NA	EXACTX	75	75	100.00	100.00	75	CAB54534.2	microcin H47	NA	NA
S1128_CU0125_IS03	DHLMFL_20890	contig_34	14928	17030	+	mchF	microcin H47 export transporter peptidase/ATP-binding subunit MchF	plus	VIRULENCE	VIRULENCE	NA	NA	BLASTP	700	700	100.00	99.86	700	AFS85685.1	microcin H47 export transporter peptidase/ATP-binding subunit MchF	NA	NA
S1128_CU0125_IS03	DHLMFL_22045	contig_39	27930	28766	-	aph(6)-Id	aminoglycoside O-phosphotransferase APH(6)-Id	core	AMR	AMR	AMINOGLYCOSIDE	STREPTOMYCIN	EXACTP	278	278	100.00	100.00	278	WP_000480972.1	aminoglycoside O-phosphotransferase APH(6)-Id	NF012171.0	APH(6)-I family aminoglycoside O-phosphotransferase
S1128_CU0125_IS03	DHLMFL_22050	contig_39	28766	29569	-	aph(3'')-Ib	aminoglycoside O-phosphotransferase APH(3'')-Ib	core	AMR	AMR	AMINOGLYCOSIDE	STREPTOMYCIN	EXACTP	267	267	100.00	100.00	267	WP_001082319.1	aminoglycoside O-phosphotransferase APH(3'')-Ib	NF032895.1	aminoglycoside O-phosphotransferase APH(3'')-Ib
S1128_CU0125_IS03	DHLMFL_22055	contig_39	29630	30445	-	sul2	sulfonamide-resistant dihydropteroate synthase Sul2	core	AMR	AMR	SULFONAMIDE	SULFONAMIDE	EXACTP	271	271	100.00	100.00	271	WP_001043260.1	sulfonamide-resistant dihydropteroate synthase Sul2	NF000295.1	sulfonamide-resistant dihydropteroate synthase Sul2
S1128_CU0125_IS03	DHLMFL_22075	contig_39	31959	32819	-	blaTEM-1	broad-spectrum class A beta-lactamase TEM-1	core	AMR	AMR	BETA-LACTAM	BETA-LACTAM	ALLELEP	286	286	100.00	100.00	286	WP_000027057.1	broad-spectrum class A beta-lactamase TEM-1	NF000531.2	TEM family class A beta-lactamase
S1128_CU0125_IS03	DHLMFL_22085	contig_39	33910	34419	+	dfrA8	trimethoprim-resistant dihydrofolate reductase DfrA8	core	AMR	AMR	TRIMETHOPRIM	TRIMETHOPRIM	EXACTP	169	169	100.00	100.00	169	WP_000571065.1	trimethoprim-resistant dihydrofolate reductase DfrA8	NF000126.2	trimethoprim-resistant dihydrofolate reductase DfrA8
S1128_CU0125_IS03	DHLMFL_04695	contig_4	103584	103850	+	ymgB	biofilm/acid-resistance regulator AriR	plus	STRESS	ACID	NA	NA	EXACTP	88	88	100.00	100.00	88	AAC74250.1	biofilm/acid-resistance regulator AriR	NA	NA
S1128_CU0125_IS03	DHLMFL_22275	contig_40	25770	26123	+	arsR	As(III)-sensing metalloregulatory transcriptional repressor ArsR	plus	STRESS	METAL	ARSENIC	ARSENIC	EXACTP	117	117	100.00	100.00	117	BAE77793.1	As(III)-sensing metalloregulatory transcriptional repressor ArsR	NA	NA
S1128_CU0125_IS03	DHLMFL_22285	contig_40	27479	27904	+	arsC	glutaredoxin-dependent arsenate reductase	plus	STRESS	METAL	ARSENIC	ARSENATE	BLASTP	141	141	100.00	94.33	141	AAA21096.1	glutaredoxin-dependent arsenate reductase	NF007456.1	glutaredoxin-dependent arsenate reductase
S1128_CU0125_IS03	DHLMFL_23460	contig_47	6685	7482	-	aggR	aggregative adherence transcriptional regulator AggR	plus	VIRULENCE	VIRULENCE	NA	NA	EXACTP	265	265	100.00	100.00	265	CAA83535.1	aggregative adherence transcriptional regulator AggR	NA	NA
S1128_CU0125_IS03	DHLMFL_23465	contig_47	8320	8670	-	aap	dispersin Aap	plus	VIRULENCE	VIRULENCE	NA	NA	BLASTP	116	116	100.00	96.55	116	CBG27807.1	dispersin Aap	NA	NA
S1128_CU0125_IS03	DHLMFL_23470	contig_47	9401	9601	+	aar	AggR-activated transcriptional regulator Aar	plus	VIRULENCE	VIRULENCE	NA	NA	EXACTP	66	66	100.00	100.00	66	ASK37426.1	AggR-activated transcriptional regulator Aar	NA	NA
S1128_CU0125_IS03	DHLMFL_23500	contig_47	15026	16264	+	aatA	dispersin export ABC transporter outer membrane protein AatA	plus	VIRULENCE	VIRULENCE	NA	NA	BLASTP	412	412	100.00	99.76	412	CAU95796.1	dispersin export ABC transporter outer membrane protein AatA	NA	NA
S1128_CU0125_IS03	DHLMFL_23755	contig_49	16120	16626	-	aaiC	type VI secretion system protein AaiC/Hcp2	plus	VIRULENCE	VIRULENCE	NA	NA	EXACTP	168	168	100.00	100.00	168	CBG37385.1	type VI secretion system protein AaiC/Hcp2	NA	NA
S1128_CU0125_IS03	DHLMFL_23830	contig_50	4974	5552	-	terD	tellurium resistance membrane protein TerD	plus	STRESS	METAL	TELLURIUM	TELLURIUM	BLASTP	192	192	100.00	95.31	192	AAA98292.1	tellurium resistance membrane protein TerD	NA	NA
S1128_CU0125_IS03	DHLMFL_23850	contig_50	8299	8880	-	terZ	tellurium resistance-associated protein TerZ	plus	STRESS	METAL	TELLURIUM	TELLURIUM	BLASTP	193	193	100.00	98.96	193	AAA86846.1	tellurium resistance-associated protein TerZ	NA	NA
S1128_CU0125_IS03	DHLMFL_23885	contig_50	15453	15920	+	terW	tellurium resistance protein TerW	plus	STRESS	METAL	TELLURIUM	TELLURIUM	BLASTP	155	155	100.00	98.71	155	AAC44736.1	tellurium resistance protein TerW	NA	NA
S1128_CU0125_IS03	DHLMFL_24145	contig_53	10984	12072	+	capU	putative hexosyltransferase CapU	plus	VIRULENCE	VIRULENCE	NA	NA	EXACTP	362	362	100.00	100.00	362	AEQ15694.1	putative hexosyltransferase CapU	NA	NA
S1128_CU0125_IS03	DHLMFL_24360	contig_56	6449	9523	+	hlyA-alpha	RTX toxin hemolysin HlyA	plus	VIRULENCE	VIRULENCE	NA	NA	BLASTP	1024	1024	100.00	97.27	1024	CAQ77251.1	RTX toxin hemolysin HlyA	NA	NA
S1128_CU0125_IS03	DHLMFL_24600	contig_60	2973	3560	+	papH	P fimbrial minor subunit PapH	plus	VIRULENCE	VIRULENCE	NA	NA	BLASTP	195	195	100.00	98.46	195	CAA43563.1	P fimbrial minor subunit PapH	NA	NA
S1128_CU0125_IS03	DHLMFL_24605	contig_60	3610	6129	+	papC	P fimbrial usher protein PapC	plus	VIRULENCE	VIRULENCE	NA	NA	BLASTP	839	836	100.00	96.31	841	CAA43564.1	P fimbrial usher protein PapC	NA	NA
S1128_CU0125_IS03	DHLMFL_24630	contig_60	8727	9227	+	papF	P fimbrial tip protein PapF	plus	VIRULENCE	VIRULENCE	NA	NA	BLASTP	166	167	100.00	91.02	167	CAA43569.1	P fimbrial tip protein PapF	NA	NA
S1128_CU0125_IS03	DHLMFL_24635	contig_60	9271	10281	+	papG-II	P fimbria tip G-adhesin PapG-II	plus	VIRULENCE	VIRULENCE	NA	NA	BLASTP	336	337	100.00	98.22	337	AAA24293.1	P fimbria tip G-adhesin PapG-II	NA	NA
S1128_CU0125_IS03	DHLMFL_24715	contig_62	5350	9468	+	pic	serine protease autotransporter toxin Pic	plus	VIRULENCE	VIRULENCE	NA	NA	EXACTP	1372	1372	100.00	100.00	1372	CAU99295.1	serine protease autotransporter toxin Pic	NA	NA
S1128_CU0125_IS03	DHLMFL_24755	contig_63	3341	3937	+	aggD	aggregative adherence fimbria I chaperone AggD	plus	VIRULENCE	VIRULENCE	NA	NA	PARTIALP	198	252	78.57	98.99	198	AAA57451.1	aggregative adherence fimbria I chaperone AggD	NA	NA
S1128_CU0125_IS03	DHLMFL_24760	contig_63	4095	6479	+	aggC	aggregative adherence fimbria I usher protein AggC	plus	VIRULENCE	VIRULENCE	NA	NA	BLASTP	794	842	94.30	99.75	794	AAA57452.1	aggregative adherence fimbria I usher protein AggC	NA	NA
S1128_CU0125_IS03	DHLMFL_24765	contig_63	6493	6930	+	aggB	aggregative adherence fimbria I minor subunit AggB	plus	VIRULENCE	VIRULENCE	NA	NA	BLASTP	145	145	100.00	98.62	145	EHF16297.1	aggregative adherence fimbria I minor subunit AggB	NA	NA
S1128_CU0125_IS03	DHLMFL_24770	contig_63	7031	7546	+	aggA	aggregative adherence fimbria I major subunit AggA	plus	VIRULENCE	VIRULENCE	NA	NA	BLASTP	171	171	100.00	97.66	171	AAR02190.1	aggregative adherence fimbria I major subunit AggA	NA	NA
S1128_CU0125_IS03	DHLMFL_07900	contig_7	129338	130471	+	blaEC	BlaEC family class C beta-lactamase	plus	AMR	AMR	BETA-LACTAM	BETA-LACTAM	EXACTP	377	377	100.00	100.00	377	AAC77110.1	BlaEC family class C beta-lactamase	NF000185.2	BlaEC family class C beta-lactamase
S1128_CU0125_IS03	DHLMFL_08160	contig_8	18358	18666	+	asr	acid resistance repetitive basic protein Asr	plus	STRESS	ACID	NA	NA	EXACTP	102	102	100.00	100.00	102	BAA15331.2	acid resistance repetitive basic protein Asr	NF033636.1	acid resistance repetitive basic protein Asr
S1128_CU0125_IS03	DHLMFL_25515	contig_92	659	1996	-	iucD	NADPH-dependent L-lysine N(6)-monooxygenase IucD	plus	VIRULENCE	VIRULENCE	NA	NA	BLASTP	445	445	100.00	99.78	445	AAD44749.1	NADPH-dependent L-lysine N(6)-monooxygenase IucD	NA	NA
S1128_CU0125_IS03	DHLMFL_25585	contig_99	143	1090	-	iucB	N(6)-hydroxylysine O-acetyltransferase IucB	plus	VIRULENCE	VIRULENCE	NA	NA	BLASTP	315	315	100.00	99.68	315	AAN82074.1	N(6)-hydroxylysine O-acetyltransferase IucB	NA	NA
