Name	Protein identifier	Contig id	Start	Stop	Strand	Gene symbol	Sequence name	Scope	Element type	Element subtype	Class	Subclass	Method	Target length	Reference sequence length	% Coverage of reference sequence	% Identity to reference sequence	Alignment length	Accession of closest sequence	Name of closest sequence	HMM id	HMM description
S1198_CU0785_IS03	NA	contig_102	60	596	+	aggR	aggregative adherence transcriptional regulator AggR	plus	VIRULENCE	VIRULENCE	NA	NA	INTERNAL_STOP	179	265	67.55	99.44	179	CAA83535.1	aggregative adherence transcriptional regulator AggR	NA	NA
S1198_CU0785_IS03	LJFEJK_10970	contig_11	5200	8304	-	acrF	multidrug efflux RND transporter permease subunit AcrF	plus	AMR	AMR	EFFLUX	EFFLUX	BLASTP	1034	1034	100.00	99.52	1034	AAC76298.1	multidrug efflux RND transporter permease subunit AcrF	NA	NA
S1198_CU0785_IS03	LJFEJK_14255	contig_15	117974	119395	+	espX1	type III secretion system effector EspX1	plus	VIRULENCE	VIRULENCE	NA	NA	BLASTP	473	473	100.00	91.54	473	ADD54679.1	type III secretion system effector EspX1	NA	NA
S1198_CU0785_IS03	LJFEJK_14560	contig_16	49410	49934	-	lpfA	long polar fimbria major subunit LpfA	plus	VIRULENCE	VIRULENCE	NA	NA	EXACTP	174	174	100.00	100.00	174	CAV00478.1	long polar fimbria major subunit LpfA	NA	NA
S1198_CU0785_IS03	NA	contig_163	2	232	-	agg3B	aggregative adherence fimbria 3 minor subunit Agg3B	plus	VIRULENCE	VIRULENCE	NA	NA	PARTIAL_CONTIG_ENDX	77	146	52.74	100.00	77	AAM88297.1	aggregative adherence fimbria 3 minor subunit Agg3B	NA	NA
S1198_CU0785_IS03	LJFEJK_15470	contig_18	24299	25531	-	mdtM	multidrug efflux MFS transporter MdtM	plus	AMR	AMR	EFFLUX	EFFLUX	BLASTP	410	410	100.00	97.56	410	AAC77293.1	multidrug efflux MFS transporter MdtM	NA	NA
S1198_CU0785_IS03	LJFEJK_16150	contig_19	47360	51613	+	fdeC	intimin-like adhesin FdeC	plus	VIRULENCE	VIRULENCE	NA	NA	BLASTP	1417	1416	99.93	91.24	1415	ABE05822.1	intimin-like adhesin FdeC	NA	NA
S1198_CU0785_IS03	LJFEJK_02045	contig_2	75750	76058	+	asr	acid resistance repetitive basic protein Asr	plus	STRESS	ACID	NA	NA	BLASTP	102	102	100.00	96.08	102	BAA15331.2	acid resistance repetitive basic protein Asr	NF033636.1	acid resistance repetitive basic protein Asr
S1198_CU0785_IS03	NA	contig_25	3865	4413	-	tccP	Tir-cytoskeleton coupling protein TccP2	plus	VIRULENCE	VIRULENCE	NA	NA	PARTIALX	183	344	53.20	99.45	183	BAF52366.1	Tir-cytoskeleton coupling protein TccP2	NA	NA
S1198_CU0785_IS03	LJFEJK_18920	contig_26	1692	2315	-	espF	type III secretion system LEE effector EspF	plus	VIRULENCE	VIRULENCE	NA	NA	HMM	207	259	81.47	74.77	214	CAX18635.1	type III secretion system LEE effector EspF	NF040807.1	type III secretion system LEE effector EspF
S1198_CU0785_IS03	LJFEJK_18965	contig_26	8893	11712	-	eae	intimin	plus	VIRULENCE	VIRULENCE	INTIMIN	INTIMIN	HMM	939	940	100.00	90.21	940	ABF69122.1	intimin	NF033627.3	intimin
S1198_CU0785_IS03	LJFEJK_18975	contig_26	12383	14023	-	tir	type III secretion system LEE translocated intimin receptor Tir	plus	VIRULENCE	VIRULENCE	NA	NA	BLASTP	546	550	100.00	98.36	550	BAF52548.1	type III secretion system LEE translocated intimin receptor Tir	NF033637.1	type III secretion system LEE translocated intimin receptor Tir
S1198_CU0785_IS03	LJFEJK_20065	contig_29	49210	50343	+	blaEC	BlaEC family class C beta-lactamase	plus	AMR	AMR	BETA-LACTAM	BETA-LACTAM	BLASTP	377	377	100.00	98.67	377	WP_063610930.1	extended-spectrum class C beta-lactamase EC-15	NF000185.2	BlaEC family class C beta-lactamase
S1198_CU0785_IS03	LJFEJK_03420	contig_3	69438	69704	-	ymgB	biofilm/acid-resistance regulator AriR	plus	STRESS	ACID	NA	NA	EXACTP	88	88	100.00	100.00	88	AAC74250.1	biofilm/acid-resistance regulator AriR	NA	NA
S1198_CU0785_IS03	LJFEJK_20950	contig_33	17079	17651	-	lpfA	long polar fimbria major subunit LpfA-O113	plus	VIRULENCE	VIRULENCE	NA	NA	EXACTP	190	190	100.00	100.00	190	AAT76975.1	long polar fimbria major subunit LpfA-O113	NA	NA
S1198_CU0785_IS03	LJFEJK_21215	contig_34	26201	27103	+	fieF	CDF family cation-efflux transporter FieF	plus	STRESS	METAL	NA	NA	EXACTP	300	300	100.00	100.00	300	BAE77395.1	CDF family cation-efflux transporter FieF	NA	NA
S1198_CU0785_IS03	LJFEJK_06475	contig_6	29297	33862	-	sslE	lipoprotein metalloprotease SslE	plus	VIRULENCE	VIRULENCE	NA	NA	HMM	1521	1520	100.00	88.17	1522	ADE89421.1	lipoprotein metalloprotease SslE	NF037973.1	lipoprotein metalloprotease SslE
S1198_CU0785_IS03	NA	contig_63	77	688	+	espJ	type III secretion system effector ADP-ribosyltransferase EspJ	plus	VIRULENCE	VIRULENCE	NA	NA	BLASTX	204	217	94.01	99.02	204	BAF96525.1	type III secretion system effector ADP-ribosyltransferase EspJ	NA	NA
S1198_CU0785_IS03	LJFEJK_24845	contig_63	2698	3546	-	cif	type III secretion system effector Cif	plus	VIRULENCE	VIRULENCE	NA	NA	EXACTP	282	282	100.00	100.00	282	AAQ07241.1	type III secretion system effector Cif	NA	NA
S1198_CU0785_IS03	LJFEJK_08100	contig_7	174929	175282	+	arsR	As(III)-sensing metalloregulatory transcriptional repressor ArsR	plus	STRESS	METAL	ARSENIC	ARSENIC	EXACTP	117	117	100.00	100.00	117	BAE77793.1	As(III)-sensing metalloregulatory transcriptional repressor ArsR	NA	NA
S1198_CU0785_IS03	LJFEJK_08110	contig_7	176638	177063	+	arsC	glutaredoxin-dependent arsenate reductase	plus	STRESS	METAL	ARSENIC	ARSENATE	BLASTP	141	141	100.00	94.33	141	AAA21096.1	glutaredoxin-dependent arsenate reductase	NF007456.1	glutaredoxin-dependent arsenate reductase
