Name	Protein identifier	Contig id	Start	Stop	Strand	Gene symbol	Sequence name	Scope	Element type	Element subtype	Class	Subclass	Method	Target length	Reference sequence length	% Coverage of reference sequence	% Identity to reference sequence	Alignment length	Accession of closest sequence	Name of closest sequence	HMM id	HMM description
S1203_CU0719_IS03	GGBGHE_00035	contig_1	5368	8472	-	acrF	multidrug efflux RND transporter permease subunit AcrF	plus	AMR	AMR	EFFLUX	EFFLUX	BLASTP	1034	1034	100.00	99.81	1034	AAC76298.1	multidrug efflux RND transporter permease subunit AcrF	NA	NA
S1203_CU0719_IS03	GGBGHE_01570	contig_1	311709	316271	+	sslE	lipoprotein metalloprotease SslE	plus	VIRULENCE	VIRULENCE	NA	NA	HMM	1520	1520	100.00	87.97	1521	ADE89421.1	lipoprotein metalloprotease SslE	NF037973.1	lipoprotein metalloprotease SslE
S1203_CU0719_IS03	GGBGHE_14255	contig_12	103920	105152	+	mdtM	multidrug efflux MFS transporter MdtM	plus	AMR	AMR	EFFLUX	EFFLUX	BLASTP	410	410	100.00	99.76	410	AAC77293.1	multidrug efflux MFS transporter MdtM	NA	NA
S1203_CU0719_IS03	GGBGHE_15425	contig_14	59013	59915	-	fieF	CDF family cation-efflux transporter FieF	plus	STRESS	METAL	NA	NA	EXACTP	300	300	100.00	100.00	300	BAE77395.1	CDF family cation-efflux transporter FieF	NA	NA
S1203_CU0719_IS03	GGBGHE_17420	contig_17	85799	86983	-	emrD	multidrug efflux MFS transporter EmrD	plus	AMR	AMR	EFFLUX	EFFLUX	EXACTP	394	394	100.00	100.00	394	BAE77620.1	multidrug efflux MFS transporter EmrD	NA	NA
S1203_CU0719_IS03	NA	contig_17	108366	108479	+	astA	heat-stable enterotoxin EAST1	plus	VIRULENCE	VIRULENCE	NA	NA	EXACTX	38	38	100.00	100.00	38	AAD43578.1	heat-stable enterotoxin EAST1	NA	NA
S1203_CU0719_IS03	GGBGHE_02290	contig_2	29006	29314	+	asr	acid resistance repetitive basic protein Asr	plus	STRESS	ACID	NA	NA	BLASTP	102	102	100.00	97.06	102	BAA15331.2	acid resistance repetitive basic protein Asr	NF033636.1	acid resistance repetitive basic protein Asr
S1203_CU0719_IS03	GGBGHE_19670	contig_22	51077	51574	-	psi-GI	heat resistance protein PsiE-GI	plus	STRESS	HEAT	NA	NA	EXACTP	165	165	100.00	100.00	165	APX31178.1	heat resistance protein PsiE-GI	NA	NA
S1203_CU0719_IS03	GGBGHE_19675	contig_22	51571	53286	-	kefB-GI	heat resistance system K+/H+ antiporter KefB-GI	plus	STRESS	HEAT	NA	NA	BLASTP	571	571	100.00	99.65	571	APX31177.1	heat resistance system K+/H+ antiporter KefB-GI	NA	NA
S1203_CU0719_IS03	GGBGHE_19680	contig_22	53290	53730	-	trxLHR	heat resistance system thioredoxin Trx-GI	plus	STRESS	HEAT	NA	NA	EXACTP	146	146	100.00	100.00	146	APX31176.1	heat resistance system thioredoxin Trx-GI	NA	NA
S1203_CU0719_IS03	GGBGHE_19690	contig_22	54945	55556	-	hdeD-GI	heat resistance membrane protein HdeD-GI	plus	STRESS	HEAT	NA	NA	BLASTP	203	203	100.00	98.03	203	APX31174.1	heat resistance membrane protein HdeD-GI	NA	NA
S1203_CU0719_IS03	GGBGHE_19695	contig_22	55646	56533	-	yfdX2	heat resistance protein YfdX2	plus	STRESS	HEAT	NA	NA	BLASTP	295	295	100.00	98.64	295	ASF80766.1	heat resistance protein YfdX2	NA	NA
S1203_CU0719_IS03	GGBGHE_19700	contig_22	56636	57550	-	yfdX1	heat resistance protein YfdX1	plus	STRESS	HEAT	NA	NA	EXACTP	304	304	100.00	100.00	304	APX31172.1	heat resistance protein YfdX1	NA	NA
S1203_CU0719_IS03	GGBGHE_19705	contig_22	57573	58031	-	shsP	small heat shock protein sHSP20-GI	plus	STRESS	HEAT	NA	NA	BLASTP	152	152	100.00	99.34	152	ASF80771.1	small heat shock protein sHSP20-GI	NA	NA
S1203_CU0719_IS03	GGBGHE_19725	contig_22	63053	63622	-	hsp20	small heat shock protein sHSP20	plus	STRESS	HEAT	NA	NA	BLASTP	189	189	100.00	98.41	189	CDY80020.1	small heat shock protein sHSP20	NA	NA
S1203_CU0719_IS03	GGBGHE_21360	contig_29	16107	16532	-	arsC	glutaredoxin-dependent arsenate reductase	plus	STRESS	METAL	ARSENIC	ARSENATE	BLASTP	141	141	100.00	94.33	141	AAA21096.1	glutaredoxin-dependent arsenate reductase	NF007456.1	glutaredoxin-dependent arsenate reductase
S1203_CU0719_IS03	GGBGHE_21370	contig_29	17888	18241	-	arsR	As(III)-sensing metalloregulatory transcriptional repressor ArsR	plus	STRESS	METAL	ARSENIC	ARSENIC	EXACTP	117	117	100.00	100.00	117	BAE77793.1	As(III)-sensing metalloregulatory transcriptional repressor ArsR	NA	NA
S1203_CU0719_IS03	GGBGHE_04050	contig_3	18298	18564	+	ymgB	biofilm/acid-resistance regulator AriR	plus	STRESS	ACID	NA	NA	EXACTP	88	88	100.00	100.00	88	AAC74250.1	biofilm/acid-resistance regulator AriR	NA	NA
S1203_CU0719_IS03	GGBGHE_06075	contig_4	126312	127445	+	blaEC	BlaEC family class C beta-lactamase	plus	AMR	AMR	BETA-LACTAM	BETA-LACTAM	BLASTP	377	377	100.00	99.73	377	AAC77110.1	BlaEC family class C beta-lactamase	NF000185.2	BlaEC family class C beta-lactamase
S1203_CU0719_IS03	GGBGHE_23605	contig_53	931	1215	-	iss	increased serum survival lipoprotein Iss	plus	VIRULENCE	VIRULENCE	NA	NA	BLASTP	94	97	96.91	100.00	94	BAG76115.1	increased serum survival lipoprotein Iss	NA	NA
S1203_CU0719_IS03	GGBGHE_09235	contig_6	207859	212115	-	fdeC	intimin-like adhesin FdeC	plus	VIRULENCE	VIRULENCE	NA	NA	BLASTP	1418	1416	100.00	94.00	1416	ABE05822.1	intimin-like adhesin FdeC	NA	NA
S1203_CU0719_IS03	GGBGHE_09390	contig_7	5555	6532	-	espX1	type III secretion system effector EspX1	plus	VIRULENCE	VIRULENCE	NA	NA	PARTIALP	325	473	65.54	89.68	310	ADD54679.1	type III secretion system effector EspX1	NA	NA
