Name	Protein identifier	Contig id	Start	Stop	Strand	Gene symbol	Sequence name	Scope	Element type	Element subtype	Class	Subclass	Method	Target length	Reference sequence length	% Coverage of reference sequence	% Identity to reference sequence	Alignment length	Accession of closest sequence	Name of closest sequence	HMM id	HMM description
S1205_CU0720_IS03	EPDFJJ_10945	contig_10	140329	140637	-	asr	acid resistance repetitive basic protein Asr	plus	STRESS	ACID	NA	NA	EXACTP	102	102	100.00	100.00	102	BAA15331.2	acid resistance repetitive basic protein Asr	NF033636.1	acid resistance repetitive basic protein Asr
S1205_CU0720_IS03	EPDFJJ_11740	contig_11	128845	129978	+	blaEC	BlaEC family class C beta-lactamase	plus	AMR	AMR	BETA-LACTAM	BETA-LACTAM	EXACTP	377	377	100.00	100.00	377	AAC77110.1	BlaEC family class C beta-lactamase	NF000185.2	BlaEC family class C beta-lactamase
S1205_CU0720_IS03	EPDFJJ_15820	contig_17	58982	59884	-	fieF	CDF family cation-efflux transporter FieF	plus	STRESS	METAL	NA	NA	EXACTP	300	300	100.00	100.00	300	BAE77395.1	CDF family cation-efflux transporter FieF	NA	NA
S1205_CU0720_IS03	EPDFJJ_16550	contig_18	75024	79586	+	sslE	lipoprotein metalloprotease SslE	plus	VIRULENCE	VIRULENCE	NA	NA	BLASTP	1520	1520	100.00	90.99	1521	ADE89421.1	lipoprotein metalloprotease SslE	NF037973.1	lipoprotein metalloprotease SslE
S1205_CU0720_IS03	EPDFJJ_01430	contig_2	3585	5675	-	iha	bifunctional siderophore receptor/adhesin Iha	plus	VIRULENCE	VIRULENCE	NA	NA	EXACTP	696	696	100.00	100.00	696	AAG55323.1	bifunctional siderophore receptor/adhesin Iha	NA	NA
S1205_CU0720_IS03	EPDFJJ_01545	contig_2	27994	29718	+	iucA	aerobactin synthase IucA	plus	VIRULENCE	VIRULENCE	NA	NA	BLASTP	574	576	100.00	98.61	576	EGI25746.1	aerobactin synthase IucA	NA	NA
S1205_CU0720_IS03	EPDFJJ_01550	contig_2	29719	30666	+	iucB	N(6)-hydroxylysine O-acetyltransferase IucB	plus	VIRULENCE	VIRULENCE	NA	NA	EXACTP	315	315	100.00	100.00	315	AAN82074.1	N(6)-hydroxylysine O-acetyltransferase IucB	NA	NA
S1205_CU0720_IS03	EPDFJJ_01555	contig_2	30666	32408	+	iucC	NIS family aerobactin synthetase IucC	plus	VIRULENCE	VIRULENCE	NA	NA	EXACTP	580	580	100.00	100.00	580	AAN82073.1	NIS family aerobactin synthetase IucC	NA	NA
S1205_CU0720_IS03	EPDFJJ_01560	contig_2	32405	33742	+	iucD	NADPH-dependent L-lysine N(6)-monooxygenase IucD	plus	VIRULENCE	VIRULENCE	NA	NA	BLASTP	445	445	100.00	98.65	445	AAD44749.1	NADPH-dependent L-lysine N(6)-monooxygenase IucD	NA	NA
S1205_CU0720_IS03	EPDFJJ_01565	contig_2	33745	35943	+	iutA	ferric aerobactin receptor IutA	plus	VIRULENCE	VIRULENCE	NA	NA	BLASTP	732	731	100.00	98.91	731	AAN45165.2	ferric aerobactin receptor IutA	NA	NA
S1205_CU0720_IS03	EPDFJJ_02240	contig_2	163604	163870	+	ymgB	biofilm/acid-resistance regulator AriR	plus	STRESS	ACID	NA	NA	EXACTP	88	88	100.00	100.00	88	AAC74250.1	biofilm/acid-resistance regulator AriR	NA	NA
S1205_CU0720_IS03	EPDFJJ_17585	contig_20	86474	87658	-	emrD	multidrug efflux MFS transporter EmrD	plus	AMR	AMR	EFFLUX	EFFLUX	EXACTP	394	394	100.00	100.00	394	BAE77620.1	multidrug efflux MFS transporter EmrD	NA	NA
S1205_CU0720_IS03	EPDFJJ_18885	contig_23	60953	62212	+	mdtM	multidrug efflux MFS transporter MdtM	plus	AMR	AMR	EFFLUX	EFFLUX	BLASTP	419	410	98.29	97.52	403	AAC77293.1	multidrug efflux MFS transporter MdtM	NA	NA
S1205_CU0720_IS03	EPDFJJ_20450	contig_28	9218	9511	+	iss	increased serum survival lipoprotein Iss	plus	VIRULENCE	VIRULENCE	NA	NA	EXACTP	97	97	100.00	100.00	97	CAR12622.1	increased serum survival lipoprotein Iss	NA	NA
S1205_CU0720_IS03	EPDFJJ_21270	contig_30	28479	31517	-	fdeC	intimin-like adhesin FdeC	plus	VIRULENCE	VIRULENCE	NA	NA	PARTIALP	1012	1416	71.47	95.75	1012	ABE05822.1	intimin-like adhesin FdeC	NA	NA
S1205_CU0720_IS03	EPDFJJ_21610	contig_31	36272	37510	-	aatA	dispersin export ABC transporter outer membrane protein AatA	plus	VIRULENCE	VIRULENCE	NA	NA	EXACTP	412	412	100.00	100.00	412	CAU95796.1	dispersin export ABC transporter outer membrane protein AatA	NA	NA
S1205_CU0720_IS03	EPDFJJ_21640	contig_31	42932	43132	-	aar	AggR-activated transcriptional regulator Aar	plus	VIRULENCE	VIRULENCE	NA	NA	EXACTP	66	66	100.00	100.00	66	ASK37426.1	AggR-activated transcriptional regulator Aar	NA	NA
S1205_CU0720_IS03	EPDFJJ_21645	contig_31	43863	44213	+	aap	dispersin Aap	plus	VIRULENCE	VIRULENCE	NA	NA	BLASTP	116	116	100.00	96.55	116	CBG27807.1	dispersin Aap	NA	NA
S1205_CU0720_IS03	EPDFJJ_21650	contig_31	45054	45851	+	aggR	aggregative adherence transcriptional regulator AggR	plus	VIRULENCE	VIRULENCE	NA	NA	EXACTP	265	265	100.00	100.00	265	CAA83535.1	aggregative adherence transcriptional regulator AggR	NA	NA
S1205_CU0720_IS03	EPDFJJ_23400	contig_39	24277	24783	-	aaiC	type VI secretion system protein AaiC/Hcp2	plus	VIRULENCE	VIRULENCE	NA	NA	EXACTP	168	168	100.00	100.00	168	CBG37385.1	type VI secretion system protein AaiC/Hcp2	NA	NA
S1205_CU0720_IS03	EPDFJJ_04335	contig_4	56079	57791	+	ybtP	yersiniabactin ABC transporter ATP-binding/permease protein YbtP	plus	VIRULENCE	VIRULENCE	NA	NA	BLASTP	570	600	95.00	99.65	570	CAA21388.1	yersiniabactin ABC transporter ATP-binding/permease protein YbtP	NA	NA
S1205_CU0720_IS03	EPDFJJ_04340	contig_4	57778	59580	+	ybtQ	yersiniabactin ABC transporter ATP-binding/permease protein YbtQ	plus	VIRULENCE	VIRULENCE	NA	NA	BLASTP	600	600	100.00	99.50	600	AAC69584.1	yersiniabactin ABC transporter ATP-binding/permease protein YbtQ	NA	NA
S1205_CU0720_IS03	EPDFJJ_04565	contig_4	95987	96319	+	emrE	multidrug efflux SMR transporter EmrE	plus	STRESS	BIOCIDE	EFFLUX	EFFLUX	BLASTP	110	110	100.00	98.18	110	CAA77936.1	multidrug efflux SMR transporter EmrE	NF000336.1	multidrug efflux SMR transporter EmrE
S1205_CU0720_IS03	EPDFJJ_24225	contig_45	937	5028	-	espI	serine protease autotransporter EspI	plus	VIRULENCE	VIRULENCE	NA	NA	BLASTP	1363	1363	100.00	98.97	1363	BAI32516.1	serine protease autotransporter EspI	NA	NA
S1205_CU0720_IS03	EPDFJJ_24485	contig_48	488	1003	-	agg5A	aggregative adherence fimbria V major subunit Agg5A	plus	VIRULENCE	VIRULENCE	NA	NA	BLASTP	171	171	100.00	97.66	171	BAJ79299.1	aggregative adherence fimbria V major subunit Agg5A	NA	NA
S1205_CU0720_IS03	EPDFJJ_24490	contig_48	1178	1618	-	agg3B	aggregative adherence fimbria 3 minor subunit Agg3B	plus	VIRULENCE	VIRULENCE	NA	NA	EXACTP	146	146	100.00	100.00	146	AAM88297.1	aggregative adherence fimbria 3 minor subunit Agg3B	NA	NA
S1205_CU0720_IS03	EPDFJJ_24495	contig_48	1632	3887	-	agg3C	aggregative adherence fimbria 3 usher protein Agg3C	plus	VIRULENCE	VIRULENCE	NA	NA	PARTIALP	751	843	89.09	99.60	751	AXV27948.1	aggregative adherence fimbria 3 usher protein Agg3C	NA	NA
S1205_CU0720_IS03	EPDFJJ_24500	contig_48	4236	5138	-	agg3D	aggregative adherence fimbria 3 chaperone Agg3D	plus	VIRULENCE	VIRULENCE	NA	NA	BLASTP	300	250	100.00	99.20	250	CAU95824.1	aggregative adherence fimbria 3 chaperone Agg3D	NA	NA
S1205_CU0720_IS03	EPDFJJ_05455	contig_5	5200	8304	-	acrF	multidrug efflux RND transporter permease subunit AcrF	plus	AMR	AMR	EFFLUX	EFFLUX	EXACTP	1034	1034	100.00	100.00	1034	AAC76298.1	multidrug efflux RND transporter permease subunit AcrF	NA	NA
S1205_CU0720_IS03	EPDFJJ_24720	contig_51	2292	6410	+	pic	serine protease autotransporter toxin Pic	plus	VIRULENCE	VIRULENCE	NA	NA	EXACTP	1372	1372	100.00	100.00	1372	CAU99295.1	serine protease autotransporter toxin Pic	NA	NA
S1205_CU0720_IS03	EPDFJJ_07670	contig_7	14619	15044	-	arsC	glutaredoxin-dependent arsenate reductase	plus	STRESS	METAL	ARSENIC	ARSENATE	BLASTP	141	141	100.00	94.33	141	AAA21096.1	glutaredoxin-dependent arsenate reductase	NF007456.1	glutaredoxin-dependent arsenate reductase
S1205_CU0720_IS03	EPDFJJ_07680	contig_7	16400	16753	-	arsR	As(III)-sensing metalloregulatory transcriptional repressor ArsR	plus	STRESS	METAL	ARSENIC	ARSENIC	EXACTP	117	117	100.00	100.00	117	BAE77793.1	As(III)-sensing metalloregulatory transcriptional repressor ArsR	NA	NA
