Name	Protein identifier	Contig id	Start	Stop	Strand	Gene symbol	Sequence name	Scope	Element type	Element subtype	Class	Subclass	Method	Target length	Reference sequence length	% Coverage of reference sequence	% Identity to reference sequence	Alignment length	Accession of closest sequence	Name of closest sequence	HMM id	HMM description
S2004_CU1184_IS04	ILNICD_00685	contig_1	132867	137429	-	sslE	lipoprotein metalloprotease SslE	plus	VIRULENCE	VIRULENCE	NA	NA	HMM	1520	1520	100.00	88.03	1521	ADE89421.1	lipoprotein metalloprotease SslE	NF037973.1	lipoprotein metalloprotease SslE
S2004_CU1184_IS04	ILNICD_12760	contig_12	65655	66557	+	fieF	CDF family cation-efflux transporter FieF	plus	STRESS	METAL	NA	NA	EXACTP	300	300	100.00	100.00	300	BAE77395.1	CDF family cation-efflux transporter FieF	NA	NA
S2004_CU1184_IS04	ILNICD_15360	contig_17	9404	9670	+	ymgB	biofilm/acid-resistance regulator AriR	plus	STRESS	ACID	NA	NA	EXACTP	88	88	100.00	100.00	88	AAC74250.1	biofilm/acid-resistance regulator AriR	NA	NA
S2004_CU1184_IS04	NA	contig_170	135	359	-	qacH	quaternary ammonium compound efflux SMR transporter QacH	core	STRESS	BIOCIDE	QUATERNARY AMMONIUM	QUATERNARY AMMONIUM	PARTIAL_CONTIG_ENDX	75	125	60.00	98.67	75	WP_000121134.1	quaternary ammonium compound efflux SMR transporter QacH	NA	NA
S2004_CU1184_IS04	ILNICD_16950	contig_20	1191	5447	-	fdeC	intimin-like adhesin FdeC	plus	VIRULENCE	VIRULENCE	NA	NA	BLASTP	1418	1416	100.00	94.14	1416	ABE05822.1	intimin-like adhesin FdeC	NA	NA
S2004_CU1184_IS04	ILNICD_17510	contig_21	23757	24989	-	mdtM	multidrug efflux MFS transporter MdtM	plus	AMR	AMR	EFFLUX	EFFLUX	EXACTP	410	410	100.00	100.00	410	AAC77293.1	multidrug efflux MFS transporter MdtM	NA	NA
S2004_CU1184_IS04	ILNICD_19085	contig_26	5368	8472	-	acrF	multidrug efflux RND transporter permease subunit AcrF	plus	AMR	AMR	EFFLUX	EFFLUX	EXACTP	1034	1034	100.00	100.00	1034	AAC76298.1	multidrug efflux RND transporter permease subunit AcrF	NA	NA
S2004_CU1184_IS04	ILNICD_19625	contig_28	14616	15041	-	arsC	glutaredoxin-dependent arsenate reductase	plus	STRESS	METAL	ARSENIC	ARSENATE	BLASTP	141	141	100.00	94.33	141	AAA21096.1	glutaredoxin-dependent arsenate reductase	NF007456.1	glutaredoxin-dependent arsenate reductase
S2004_CU1184_IS04	ILNICD_19635	contig_28	16397	16750	-	arsR	As(III)-sensing metalloregulatory transcriptional repressor ArsR	plus	STRESS	METAL	ARSENIC	ARSENIC	EXACTP	117	117	100.00	100.00	117	BAE77793.1	As(III)-sensing metalloregulatory transcriptional repressor ArsR	NA	NA
S2004_CU1184_IS04	ILNICD_19745	contig_28	39856	40287	-	silE	silver-binding protein SilE	plus	STRESS	METAL	SILVER	SILVER	EXACTP	143	143	100.00	100.00	143	AAD11743.1	silver-binding protein SilE	NA	NA
S2004_CU1184_IS04	ILNICD_19750	contig_28	40532	42013	-	silS	copper/silver sensor histidine kinase SilS	plus	STRESS	METAL	COPPER/SILVER	COPPER/SILVER	BLASTP	493	491	100.00	97.76	491	SPD96882.1	copper/silver sensor histidine kinase SilS	NA	NA
S2004_CU1184_IS04	ILNICD_19755	contig_28	42006	42686	-	silR	copper/silver response regulator transcription factor SilR	plus	STRESS	METAL	COPPER/SILVER	COPPER/SILVER	BLASTP	226	226	100.00	99.56	226	SPD96883.1	copper/silver response regulator transcription factor SilR	NA	NA
S2004_CU1184_IS04	ILNICD_19760	contig_28	42876	44261	+	silC	Cu(+)/Ag(+) efflux RND transporter outer membrane channel SilC	plus	STRESS	METAL	COPPER/SILVER	COPPER/SILVER	EXACTP	461	461	100.00	100.00	461	AAD11746.1	Cu(+)/Ag(+) efflux RND transporter outer membrane channel SilC	NA	NA
S2004_CU1184_IS04	ILNICD_19765	contig_28	44289	44642	+	silF	Cu(+)/Ag(+) efflux RND transporter periplasmic metallochaperone SilF	plus	STRESS	METAL	COPPER/SILVER	COPPER/SILVER	EXACTP	117	117	100.00	100.00	117	KGL71342.1	Cu(+)/Ag(+) efflux RND transporter periplasmic metallochaperone SilF	NA	NA
S2004_CU1184_IS04	ILNICD_19770	contig_28	44756	46048	+	silB	Cu(+)/Ag(+) efflux RND transporter periplasmic adaptor subunit SilB	plus	STRESS	METAL	COPPER/SILVER	COPPER/SILVER	EXACTP	430	430	100.00	100.00	430	AAD11748.1	Cu(+)/Ag(+) efflux RND transporter periplasmic adaptor subunit SilB	NA	NA
S2004_CU1184_IS04	ILNICD_19775	contig_28	46059	49205	+	silA	Cu(+)/Ag(+) efflux RND transporter permease subunit SilA	plus	STRESS	METAL	COPPER/SILVER	COPPER/SILVER	BLASTP	1048	1048	100.00	98.57	1048	AAD11749.1	Cu(+)/Ag(+) efflux RND transporter permease subunit SilA	NA	NA
S2004_CU1184_IS04	ILNICD_21530	contig_37	496	789	+	iss	increased serum survival lipoprotein Iss	plus	VIRULENCE	VIRULENCE	NA	NA	EXACTP	97	97	100.00	100.00	97	BAG76115.1	increased serum survival lipoprotein Iss	NA	NA
S2004_CU1184_IS04	ILNICD_05880	contig_4	208301	208609	-	asr	acid resistance repetitive basic protein Asr	plus	STRESS	ACID	NA	NA	BLASTP	102	102	100.00	99.02	102	BAA15331.2	acid resistance repetitive basic protein Asr	NF033636.1	acid resistance repetitive basic protein Asr
S2004_CU1184_IS04	ILNICD_23000	contig_47	4562	5059	-	psi-GI	heat resistance protein PsiE-GI	plus	STRESS	HEAT	NA	NA	BLASTP	165	165	100.00	96.97	165	APX31178.1	heat resistance protein PsiE-GI	NA	NA
S2004_CU1184_IS04	ILNICD_23005	contig_47	5056	6771	-	kefB-GI	heat resistance system K+/H+ antiporter KefB-GI	plus	STRESS	HEAT	NA	NA	BLASTP	571	571	100.00	99.47	571	APX31177.1	heat resistance system K+/H+ antiporter KefB-GI	NA	NA
S2004_CU1184_IS04	ILNICD_23010	contig_47	6775	7215	-	trxLHR	heat resistance system thioredoxin Trx-GI	plus	STRESS	HEAT	NA	NA	BLASTP	146	146	100.00	99.32	146	APX31176.1	heat resistance system thioredoxin Trx-GI	NA	NA
S2004_CU1184_IS04	ILNICD_23020	contig_47	8430	9041	-	hdeD-GI	heat resistance membrane protein HdeD-GI	plus	STRESS	HEAT	NA	NA	BLASTP	203	203	100.00	97.54	203	APX31174.1	heat resistance membrane protein HdeD-GI	NA	NA
S2004_CU1184_IS04	ILNICD_23025	contig_47	9131	10018	-	yfdX2	heat resistance protein YfdX2	plus	STRESS	HEAT	NA	NA	BLASTP	295	295	100.00	98.98	295	ASF80766.1	heat resistance protein YfdX2	NA	NA
S2004_CU1184_IS04	ILNICD_23030	contig_47	10121	11035	-	yfdX1	heat resistance protein YfdX1	plus	STRESS	HEAT	NA	NA	EXACTP	304	304	100.00	100.00	304	APX31172.1	heat resistance protein YfdX1	NA	NA
S2004_CU1184_IS04	ILNICD_23035	contig_47	11058	11516	-	shsP	small heat shock protein sHSP20-GI	plus	STRESS	HEAT	NA	NA	BLASTP	152	152	100.00	99.34	152	ASF80771.1	small heat shock protein sHSP20-GI	NA	NA
S2004_CU1184_IS04	ILNICD_23060	contig_47	15636	16205	-	hsp20	small heat shock protein sHSP20	plus	STRESS	HEAT	NA	NA	BLASTP	189	189	100.00	97.88	189	CDY80020.1	small heat shock protein sHSP20	NA	NA
S2004_CU1184_IS04	ILNICD_06785	contig_5	123840	124973	+	blaEC	BlaEC family class C beta-lactamase	plus	AMR	AMR	BETA-LACTAM	BETA-LACTAM	EXACTP	377	377	100.00	100.00	377	AAC77110.1	BlaEC family class C beta-lactamase	NF000185.2	BlaEC family class C beta-lactamase
S2004_CU1184_IS04	ILNICD_09730	contig_8	86419	87603	-	emrD	multidrug efflux MFS transporter EmrD	plus	AMR	AMR	EFFLUX	EFFLUX	BLASTP	394	394	100.00	99.75	394	BAE77620.1	multidrug efflux MFS transporter EmrD	NA	NA
S2004_CU1184_IS04	ILNICD_10300	contig_9	23285	23617	+	emrE	multidrug efflux SMR transporter EmrE	plus	STRESS	BIOCIDE	EFFLUX	EFFLUX	BLASTP	110	110	100.00	98.18	110	CAA77936.1	multidrug efflux SMR transporter EmrE	NF000336.1	multidrug efflux SMR transporter EmrE
